811| The Montoya family spends N0 on groceries and N1 on takeout. How much of their budget do the Montoya family spend on food in total?|Answer: N0 + N1
812| A pet store had N0 rabbits and N1 hamsters. During a sale they sold N2 animals. How many animals do they have left?|Answer: (N0 + N1) - N2
813| A bucket contains N0 books. If Mary adds N1 books more, how many books will there be in all?|Answer: N0 + N1
814| Leslie and her classmates were collecting cans for a charity drive. For every N0 cans they collected, they earned one point. If Leslie collected N1 cans and her classmates collected N2 cans, how many points did they earn?|Answer: (N1 + N2) / N0
815| While on vacation, Maria took N0 pictures of the beach and N1 of the mountains. If she later deleted N2 of the pictures, how many pictures from her vacation did she still have?|Answer: (N0 + N1) - N2
816| Lucy has N0 apples. She wants to buy N1 more apples. How many apples would Lucy have then?|Answer: N0 + N1
817| If Steve swam N0 meters at N1 meters per second, how long was Steve swimming?|Answer: N0 / N1
818| A pet store had N0 rabbits and N1 hamsters. During a sale they sold N2 animals. How many animals do they have left?|Answer: (N0 + N1) - N2
819| Sam invested N0 dollars in stocks this year . He invested N1 dollars in stocks last year . How much money did Sam invest in stocks in all ?|Answer: N0 + N1
820| A flood sweeps across the valley. It covers N0 acres of the valley in water, but leaves N1 acres untouched. How many acres does the valley cover?|Answer: N0 + N1
821| A store invited N0 customers to a sale, but N1 of them didn't show up. If each customer was given N2 items, how many items do the store need?|Answer: (N0 - N1) * N2
822| Mark has N0 oranges . Susan has N1 oranges . He gives N2 oranges to Jeff . How many oranges will Mark have ?|Answer: N0 - N2
823| Jill bought N0 packs of balloons for her birthday party. There were N1 balloons in each pack. How many balloons did she buy in total?|Answer: N0 * N1
824| N0 students were enrolled in a mathematics course, and N1 students were enrolled in a history course. How many students were enrolled in both courses?|Answer: N0 + N1
825| Alan was painting his house and needed to buy N0 cans of paint. If he needed N1 cans of blue paint and N2 cans of yellow paint, how many cans of paint did he need to buy total?|Answer: N0 * ( N1 + N2 )
826| When Jake had N0 dogs , he needed to serve N1 cup of dog food each day . Now that Jake has adopted a third dog , he needs to serve a total of N2 cups each day . How much extra food is needed to feed the third dog ?|Answer: N2 - N1
827| There are N0 books on the shelf. Each book comes in a package of N1. N2 books are added to the shelf. How many books are there in the shelf?|Answer: N0 + N2
828| There are N0 students in the classroom and N1 teachers. Each student has N2 notebooks and each teacher has N3 notebooks. How many notebooks are there in all?|Answer: ( N0 * N2 ) + ( N1 * N3 )
829| The school is having a carnival. There are N0 games and N1 prizes to give away. How many prizes can each game give out?|Answer: N1 / N0
830| John was playing a card game and had N0 cards. In a difficult round he discarded N1 cards. If he received N2 more cards in the next round, how many cards would he have?|Answer: (N0 + N2) - N1
831| Heather has N0 pencils. Sarah takes N1 away. How many pencils will Heather have left?|Answer: N0 - N1
832| John had N0 books and N1 magazines in his room. If he gave away N2 of the items, how many items were still in his room?|Answer: (N0 + N1) - N2
833| Jim ate N0 apples. Alex ate N1 apples. How many apples did they eat in all?|Answer: N0 + N1
834| There are N0 trucks in the fleet and N1 drivers. If the drivers are divided equally among the trucks, how many does each truck get?|Answer: N1 / N0
835| Len cooked N0 burgers, but needed N1 total for his BBQ. If he used N2 tablespoons of ketchup on each one, how much tablespoons of ketchup does he still need?|Answer: N2 * ( N1 - N0 )
836| Tom went to N0 movies this year, but missed N1. He went to N2 movies last year. How many movies did Tom go to in all?|Answer: N0 + N2
837| Emily bought N0 new bookshelves and N1 new dressers for her house. If she spent N2 hours painting each piece of furniture, how many hours did it take her to finish?|Answer: N2 * (N0 + N1)
838| Mark has N0 apples. Andrew has N1 apples. How many apples do they have together?|Answer: N0 + N1
839| Bob lost N0 books and Jane lost N1 books in the library. How many books did they lose together?|Answer: N0 + N1
840| Sam had N0 apples in his basket. His mom gave him N1 apples. How many apples does Sam have now?|Answer: N0 + N1
841| N0 is N1 times the difference between N2 and N3. What is the number?|Answer: ( N2 - N3 ) * N1
842| John bought N0 apples this week and N1 apples last week. How many apples did John buy in all?|Answer: N0 + N1
843| John bought N0 pencils that came in boxes of N1 . How many boxes of pencils did John buy?|Answer: N0 / N1
844| Scarlett made a cake with N0 cups of sugar and N1 tablespoons of baking powder. How many measuring units of ingredients did Scarlett use in all?|Answer: N0 + N1
845| At Joe's Cafe a group with N0 couples and N1 families came in to eat. If each meal cost N2 dollars, how much was the bill?|Answer: N2 * (N0 + N1)
846| A baker had N0 loaves of bread to sell. If N1 loaves were sold and N2 customers bought more loaves, how many loaves would be left?|Answer: (N0 + N2) - N1
847| There are N0 dogs in each yard. How many dogs are in N1 yards?|Answer: N0 * N1
848| A farmer estimates that he will purchase N0 bags of fertilizer. After careful consideration, he decides to purchase N1 additional bags of fertilizer. How many bags of fertilizer does the farmer purchase?|Answer: N0 + N1
849| Jack has N0 red apples, Tom has N1 red apples, and Mary has N2 red apples. How many red apples do they have in total?|Answer: (N0 + N1) + N2
850| John has N0 bags of candy. Each bag holds N1 pieces of candy and there are N2 bags in a case. How many pieces of candy does John have?|Answer: N0 * N1
851| There are N0 students in a classroom. Each student has N1 pencils. How many pencils are there in total?|Answer: N0 * N1
852| Robert and his dad were collecting apples from their orchard. Robert picked N0 and his father picked N1. If only N2 of the apples were ripe, how many unripe apples did they have?|Answer: (N0 + N1) - N2
853| Joey starts with N0 apples. He eats N1 of them. How many apples does Joey have left?|Answer: N0 - N1
854| There are N0 trees . Each tree has N1 apples in it . How many apples are there in all?|Answer: N0 * N1
855| Tina jogged N0 yards at N1 yards per minute. How long did Tina jog?|Answer: N0 / N1
856| A baker needed to bake N0 cakes for a party. Each cake takes N1 minutes to prepare. If he already baked N2 cakes, how much longer will he take to bake the rest?|Answer: N1 * (N0 - N2)
857| April's discount flowers was having a sale where each flower was N0 dollars. If April started with N1 flowers and sold N2 of them, how much money did she make?|Answer: N0 * (N1 - N2)
858| James was baking cookies for a bake sale. He started with N0 ingredients and used N1 of them to make a large batch of cookies. He then used N2 ingredients to make each of his small batches. How many small batches of cookies did James make?|Answer: ( N0 - N1 ) / N2
859| John has two cats. The black cat is N0 pounds heavy. The white cat is N1 times heavier than the black cat. How much does the white cat weigh?|Answer: N0 * N1
860| Robert has N0 cars . Daniel takes N1 away . How many cars will Robert have ?|Answer: N0 - N1
861| At the school carnival, Jeff ran a game booth where he sold N0 tickets for N1 dollars each and N2 t-shirts for N3 dollars each. How much money did he earn?|Answer: N1 * N0 + N3 * N2
862| The school is hosting a concert. There are N0 chairs and N1 students attending. How many chairs will be left unoccupied?|Answer: N0 - N1
863| Joe and Sam go to the park. Joe collects N0 leaves while Sam collects N1 times as many leaves as Joe. How many leaves did Sam collect?|Answer: N0 * N1
864| Mrs. Franklin had N0 pieces of candy . Mrs. Franklin gave some to her students . Now she has N1 pieces. How many pieces of candy did Mrs. Franklin give to her students ?|Answer: N0 - N1
865| Jack has N0 apples in his basket. After giving N1 apples to his sister, he has N2 apples left. How many apples did he give to his sister?|Answer: N0 - N2
866| Sally had N0 pieces of jewelry , but needed N1 total for a complete collection . If each one costs $ N2 , how much money would she need to finish her collection ?|Answer: N2 * ( N1 - N0 )
867| Jill invited N0 students to her school's carnival. They each rode N1 rides. How many rides did they ride in total?|Answer: N0 * N1
868| There are N0 books and N1 pens in the drawer. Sam placed N2 pens in the drawer. How many pens are now there in total?|Answer: N1 + N2
869| Chris starts with N0 books. He borrows another N1 from the library. How many books does Chris have in total?|Answer: N0 + N1
870| Ned was trying to upgrade his phone. He bought N0 phones from a store and bought N1 more from a friend. If N2 of the phones were damaged, how many good phones did he end up with?|Answer: (N0 + N1) - N2
871| Frank and his friend were renting snowboards from the ski shop for N0 dollars each. How much did they spend if Frank rented N1 snowboards and his friend rented N2 snowboards?|Answer: N0 * (N1 + N2)
872| In Mr. Olsen's chemistry class, N0 students received A's and N1 received B's. What percentage of the students received either A's or B's?|Answer: (N0 + N1) / 100
873| Alex had N0 apples. For her birthday she got N1 more apples but gave N2 away to her friends. How many apples does she have now?|Answer: (N0 + N1) - N2
874| Sally has N0 balls, George has N1 balls, and John has N2 balls. How many balls do they have together? |Answer: ( N0 + N1 ) + N2
875| Jean has N0 coins in her piggy bank. If the coins are divided into N1 piles, how much money is in each pile? |Answer: N0 / N1
876| There were N0 pieces of toys in a box. If N1 pieces were cars and the rest were dolls, how many were dolls?|Answer: N0 - N1
877| Mike has N0 apples. Andrew has N1 apples. If Mike gives all of his apples to Andrew, how many apples will Andrew have?|Answer: N0 + N1
878| Emma bought N0 books and N1 pens. Adam bought N2 books. How many books did they buy in total?|Answer: N0 + N2
879| There are N0 tennis courts currently in the park . Park workers will build N1 additional tennis courts today . How many tennis courts will the park have when the workers are finished ?|Answer: N0 + N1
880| A store has a supply of N0 books for adults and N1 books for children. How many books are available overall?|Answer: N0 + N1
881| A shopkeeper bought a box of N0 apples. Then she sold N1 apples from the box. How many apples are left in the box now?|Answer: N0 - N1
882| At the fair, Sarah bought N0 balloons for a total of N1 dollars. If she later won N2 more balloons and spent N3 dollars on cotton candy, how many balloons would she have?|Answer: (N0 + N2) - N3
883| David has N0 apples. He gives N1 apples to his friend. Later, David trades N2 apples for N3 oranges. How many apples does David have in all?|Answer: N0 - N1 + N2
884| John had N0 toys in his room. He donated N1 of them to charity and organized the rest into boxes with N2 toys in each one. How many boxes did John end up with?|Answer: ( N0 - N1 ) / N2
885| A new office building needed N0 desks. The builder had already installed N1 of them. If it takes N2 minutes to install each desk, how long will it take him to install the rest?|Answer: N2 * ( N0 - N1 )
886| Tom went to a grocery store to buy apples. Each apple cost N0 dollars. How much money did Tom spend for the N1 apples he bought?|Answer: N0 * N1
887| A zoologist measured N0 animals that weighed N1 pounds and a second animal that weighed N2 pounds. How much heavier was the first animal?|Answer: N1 - N2
888| A electronics store has a total of N0 items in stock. If N1 of its items are televisions, how many of its items are other types of electronics?|Answer: N0 - N1
889| Bianca and her friends were planting trees for their class. For every N0 trees they planted they earned one point. If Bianca planted N1 trees and her friends planted N2 trees, how many points did they earn?|Answer: (N0 + N1) / N0
890| Wayne collects N0 books. Wayne's father gives Wayne N1 more. Wayne's mother gives him N2 more. How many books does Wayne have?|Answer: N0 + N1 + N2
891| Kaleb was baking pies for a party . On Saturday he made N0 pies and on Sunday he made N1 more pies . If each pie required N2 cups of flour , how many cups of flour did he use total ?|Answer: N2 * ( N0 + N1 )
892| Mrs. Santiago has N0 apples. Mrs. Garrett has N1. How many more apples does Mrs. Santiago have than Mrs. Garrett?|Answer: N0 - N1
893| While shopping for books online, Sally bought N0 history books and N1 science books. Each book came with a summary and had N2 chapters. How many chapters did Sally buy in total?|Answer: N2 * ( N0 + N1 )
894| John had N0 apples. He ate N1 of them, but still had N2 baskets of apples left. If each basket has the same number of apples in it, how many apples are in each basket?|Answer: ( N0 - N1 ) / N2
895| When Haley and her N1 friends visit the park, they have N0 Frisbees to play with. If they divide the Frisbees evenly, how many Frisbees will each person receive?|Answer: N0 / N1
896| A bakery had N0 cakes and N1 pies. During a promotion they gave away N2 desserts. How many desserts do they have left?|Answer: (N0 + N1) - N2
897| Jack had N0 apples in his basket, he gave N1 to his friend. How many apples does he now have?|Answer: N0 - N1
898| Alex has N0 books. He gets N1 more from his friend. Later, Alex sells N2 books at the store. How many books does Alex have in all?|Answer: N0 + N1
899| Emma has N0 pencils. Sarah has N1 pencils. If Emma gives all of her pencils to Sarah, how many pencils will Sarah have?|Answer: N0 + N1
900| Sarah earned $ N0 in December. She earned $ N1 in January and $ N2 in February. She then bought a new laptop for $ N3. How much money does Sarah have left?|Answer: ( N0 + ( N1 + N2 ) ) - N3
901| Paige had N0 books in her library. If she donated N1 books to her school and then bought N2 new books, how many books does she have in her library?|Answer: (N0 + N2) - N1
902| Sarah collected N0 apples and Tim collected N1 apples from the apple tree. How many apples were collected in total?|Answer: N0 + N1
903| While camping, Joe took N0 pictures of the lake and N1 pictures of the mountains. If he later deleted N2 of the pictures, how many pictures from his trip did he still have?|Answer: (N0 + N1) - N2
904| Iesha has N0 boxes. N1 are filled with toys and the rest are filled with books. How many boxes filled with books does Iesha have?|Answer: N0 - N1
905| At the schools book fair Sam bought N0 art books and N1 science fiction books . If N2 of the books were damaged, how many new books did he buy ?|Answer: ( N0 + N1 ) - N2
906| Adam had N0 pieces of candy. If he gave N1 pieces away and used the money he earned to buy N2 more pieces, how many pieces of candy would Adam have?|Answer: ( N0 + N2 ) - N1
907| Sam had N0 apples. Jane had N1 apples. How many apples did they have in all?|Answer: N0 + N1
908| Mr. Smith sold N0 apples every N1 seconds. How many apples did he sell in N2 seconds?|Answer: N0 * ( N2 / N1 )
909| The school is having a picnic and N0 students are attending. Each picnic table can accommodate N1 people. How many tables will be needed to seat all the students?|Answer: N0 / N1
910| Sarah had N0 apples . John gave her some more apples . Now , Sarah has N1 apples . How many apples did John give to Sarah ?|Answer: N1 - N0
911| Paige and her friends were collecting cans for a fundraiser. For every N0 cans they collected, they earned one point. If Paige collected N1 cans and her friends collected N2 cans, how many points did they earn?|Answer: (N1 + N2) / N0
912| Evelyn's basketball team practiced N0 times this season. She attended N1 practices. How many basketball practices did Evelyn miss?|Answer: N0 - N1
913| Maria saved N0 dollars from babysitting and N1 dollars from tutoring. If she only spends N2 dollars a week, how long will the money last her?|Answer: ( N0 + N1 ) / N2
914| The school cafeteria ordered N0 boxes of chocolate and N1 boxes of strawberry ice cream for students lunches. But, if only N2 students wanted dessert, how many extra did the cafeteria end up with?|Answer: (N0 + N1) - N2
915| A delivery truck full of fruits crashes into a ditch. By the time the truck is fixed, N0 fruits have spilled into the ditch. Only N1 fruits remain in the truck. How many fruits did the truck originally contain?|Answer: N0 + N1
916| Mark had N0 apples and N1 oranges in his basket. Steve had N2 apples. How many apples did they have in all?|Answer: N0 + N2
917| Jack picked N0 apples and Ryan picked N1 apples . Mary picked N2 oranges . How many apples were picked in total ?|Answer: N0 + N1
918| At a movie night, Mason and his friends ate N0 slices of pepperoni pizza and N1 slices of cheese pizza. How many slices of pizza did they eat in all?|Answer: N0 + N1
919| If Peter ran for N0 minutes at N1 miles per hour . How far did Peter go ?|Answer: N0 * N1
920| If Mark drove N0 miles at N1 miles per hour, how long was Mark driving?|Answer: N0 / N1
921| Amy went to N0 movies this month . She went to N1 movies last month , and plans to go to N2 movies next month . How many movies will she watch in all ?|Answer: ( N0 + N1 ) + N2
922| Jake's cooking class measured the temperature of the oven each day. They measured N0 degrees on Monday, N1 degrees on Tuesday, and N2 degrees on Wednesday. How many degrees did the class measure in all?|Answer: (N0 + N1) + N2
923| There are N0 cats currently in the park . Park workers will bring cats today . When the workers are finished there will be N1 cats in the park . How many cats did the workers bring today ?|Answer: N1 - N0
924| Mike had N0 pieces of candy. If he ate N1 candies and shared the rest with his friends, giving N2 pieces to each of them, how many pieces of candy does he have left?|Answer: ( N0 - N1 ) % N2
925| Tyler had N0 oranges. Each orange had N1 seeds. How many seeds does Tyler now have?|Answer: N0 * N1
926| Sophie had N0 pencils in her pencil case. She gave N1 of them away and split the rest into groups of N2 pencils. How many groups did Sophie create?|Answer: ( N0 - N1 ) / N2
927| David has N0 red balloons , Lucy has N1 red balloons , and Max has N2 red balloons . How many red balloons do they have in all ?|Answer: (N0 + N1) + N2
928| If there are N0 cats in a house and Ashley adds N1 more cats, how many cats are in the house? |Answer: N0 + N1
929| George drove to Jessica's house. It is N0 miles from George's house to Jessica's house. It took George N1 hours to get there. How fast did George go?|Answer: N0 / N1
930| If each item costs $ N0 , how much must Kim pay for N1 items ?|Answer: N0 * N1
931| A store had N0 bags of candy. In one day they sold N1 of them and put the rest into boxes with N2 in each box. How many boxes did they use?|Answer: ( N0 - N1 ) / N2
932| Sara had N0 pencils and N1 erasers in her schoolbag. Her teacher borrowed N2 erasers from Sara. How many erasers does she have now?|Answer: N1 - N2
933| John has N0 coins . Maria gives John N1 more . How many coins does John have in all ?|Answer: N0 + N1
934| Maria purchased a bike for $ N0 , a helmet for $ N1 , and a lock for $ N2 . How much did Maria spend on these items?|Answer: ( N0 + N1 ) + N2
935| Sarah bought N0 books and gave N1 to her best friend. If each book has N2 pages inside it, how many pages did Sarah still have?|Answer: N2 * (N0 - N1)
936| Virginia has N0 books and N1 pens. If she shares the books among N2 friends, how many books does each friend get?|Answer: N0 / N2
937| John had N0 apples, and N1 were rotten. Mary bought N2 of John's apples. How many apples does John have now?|Answer: N0 - N2
938| Joe was a delivery driver and he made N0 dollars an hour. On Monday he drove N1 miles and on Tuesday he drove N2 miles. How much money did Joe make in those two days? |Answer: N0 * (N1 + N2)
939| If you have purchased N0 items for a total of N1 dollars, how much did you pay per item on average?|Answer: N1 / N0
940| John had N0 books and Mary had N1 books in their library. How many books were in their library together?|Answer: N0 + N1
941| Mrs. Hilt bought N0 tickets for a show. Each ticket cost N1 dollars. How much money did Mrs. Hilt spend?|Answer: N0 * N1
942| John was trying to buy a new car. He took out a loan of N0 dollars and saved an additional N1 dollars from his job. If the car cost N2 dollars, how much money did he still need to pay for the car?|Answer: (N2 - N0 - N1)
943| John bought N0 apples and N1 oranges at the store. After eating N2 apples, how many pieces of fruit did he still have?|Answer: (N0 + N1) - N2
944| If Judy ran N0 meters at N1 meters per second, how long was Judy running?|Answer: N0 - N1
945| Matthew sold N0 t-shirts for each hour he worked. If he worked N1 hours, but sold N2 fewer t-shirts than expected, how much money did he actually earn?|Answer: N0 * ( N1 - N2 )
946| Joe's family is going on a road trip. If each car can hold N0 people and there are N1 family members, how many cars will they need?|Answer: (N1) / N0
947| Lisa drove N0 miles at N1 miles per hour. How long did Lisa drive? |Answer: N0 / N1
948| Marcus was selling his toys at a flea market. He sold N0 cars and N1 action figures. If each toy cost N2 dollars, how much money did he earn?|Answer: N1 * ( N0 + N1 )
949| John was baking cupcakes for a party. On Friday he made N0 batches and on Saturday he made N1 more batches. If each batch had N2 cupcakes in it, how many cupcakes did he make total?|Answer: N2 * ( N0 + N1 )
950| Eric has N0 chairs and N1 tables in his room. Each chair has N2 legs and each table has N3 legs. How many legs are in the room?|Answer: N0 * N2 + N1 * N3
951| At the carnival John bought N0 balloons for N1 coins each. Later he won N2 more coins and bought N3 more balloons. How many coins did he have left?|Answer: (N0 * N1) + N2 - (N3 * N1)
952| There are N0 children in a playground with N1 swings. How many more children are there than swings?|Answer: N0 - N1
953| Caroline had N0 boxes of candy, but needed N1 total for her party. If she used N2 pieces of candy in each box, how many pieces of candy does she still need?|Answer: N2 * ( N1 - N0 )
954| There are N0 pencils in a box . Deborah has N1 pencils in a bag . Susan takes N2 pencils out of the box . How many pencils are left in the box?|Answer: N0 - N2
955| For the school bake sale, Connor made pies. He baked N0 pies and N1 tarts. After the sale he had N2 to take back home. How many pies and tarts did he sell?|Answer: ( N0 + N1 ) - N2
956| There are N0 people waiting for a bus. If N1 of them left and the rest were split into N2 lines, how many people would be in each line?|Answer: ( N0 - N1 ) / N2
957| Nancy collected N0 books from the library. She put N1 books in one shelf and placed the remaining books in N2 different shelves. How many books were on each shelf?|Answer: ( N0 - N1 ) / N2
958| On his vacation last summer, James visited all the art galleries in Chicago. First, he walked N0 miles from his hotel to the first gallery. Then he walked N1 miles from the first gallery to the second gallery and N2 miles from the second gallery back to the hotel. How many miles did James walk in all?|Answer: (N0 + N1) + N2
959| Sally has N0 apples and N1 oranges. She gave away N2 of the apples. How many apples does Sally have now?|Answer: N0 - N2
960| Tom was counting the number of books he had in his collection. He had N0 books about history, N1 books about science and N2 books about literature. How many books did Tom have in total?|Answer: (N0 + N1) + N2
961| Mr. Guzman bought N0 pens, which were equally distributed into N1 boxes. How many pens were in each box?|Answer: N0 / N1
962| Bob picked N0 apples and Mary picked N1 apples from the apple tree. How many apples were picked in total?|Answer: N0 + N1
963| A bakery sold N0 cupcakes in the morning and N1 in the afternoon. How many cupcakes were sold today?|Answer: N0 + N1
964| John runs N0 kilometers in an hour and Nina runs N1 kilometers in an hour. How much farther does John run than Nina?|Answer: N0 - N1
965| Joe had N0 pieces of candy in a jar. He ate N1 pieces and gave N2 pieces away. How many pieces of candy does he have left?|Answer: ( N0 - N1 ) + N2
966| For Christmas, Jack and his brother combined the presents they received. Jack had N0 presents while his brother had N1. If they opened N2 presents the first night, how many presents do they have left?|Answer: (N0 + N1) - N2
967| John has N0 pens. He buys N1 more from the store. How many pens does John have in total?|Answer: N0 + N1
968| There are N0 books on the shelf . Mary took N1 books from the shelf . How many books are now on the shelf ?|Answer: N0 - N1
969| Mrs. Hilt went to a movie theater. A total of N0 people attended the movie. The next week, she went to a second theater, which had N1 more people in attendance. How many people were at the second theater?|Answer: N0 + N1
970| Max has N0 apples . Sarah has N1 oranges . How many fruits do they have together ?|Answer: N0 + N1
971| There are N0 books in a shelf . Louise has N1 books in a drawer . Scott takes N2 books out of the shelf . How many books are left in the shelf?|Answer: N0 - N2
972| Judy bought N0 pieces of candy. How many packages of N1 pieces, plus extra pieces does Judy need to purchase?|Answer: N0 / N1
