1621| At the store , Bill bought N0 bags of chips and N1 boxes of cookies . If he later returned N2 of the items , how many items did he still have ?|Answer: ( N0 + N1 ) - N2
1622| Emma buys N0 oranges for N1 dollars each. For each additional orange she purchases, she gets N2 dollars off. If she buys N3 oranges, how much money does she spend?|Answer: ( N0 * N1 ) + ( N2 * ( N3 - N0 ) )
1623| Dan has N0 blue and N1 orange marbles. Mike took N2 of Dan's blue marbles. How many blue marbles does Dan now have?|Answer: N0 - N2
1624| There are N0 pieces of candy in Jane's candy jar. If the candy is organized into N1 rows, how many pieces of candy are in each row?|Answer: N0 / N1
1625| A construction company bought N0 gallons of paint and N1 gallons of primer. How many gallons of material did the company buy in all?|Answer: N0 + N1
1626| Sara has N0 apples and N1 oranges. Tom has N2 apples. How many apples do they have in total?|Answer: N0 + N2
1627| Ryan has N0 balloons. He gives N1 away. How many balloons will Ryan have? |Answer: N0 - N1
1628| The Fire baseball team has N0 players. Each player has N1 bats. How many bats do they have in total?|Answer: N0 * N1
1629| Mary and her brother were buying apples from the grocery store for N0 dollars each. How much did they spend if Mary bought N1 apples and her brother bought N2 apples?|Answer: N0 * (N1 + N2)
1630| John had N0 apples and N1 oranges. He wanted to divide them evenly into N2 baskets. How many apples and oranges did he put in each basket?|Answer: ( N0 + N1 ) / N2
1631| Walter just bought a new couch for his living room. The old couch was N0 inches wide and the new couch is N1 inches wide. How much wider is the new couch than the old couch?|Answer: N1 - N0
1632| Haley has N0 books in her library. She plans to donate them to the local charity shop. If she puts them in bags which can contain N1 books, how many bags will Hayley need? |Answer: N0 / N1
1633| Toni had N0 apples. Liza had N1 apples. How many apples did they have in total?|Answer: N0 + N1
1634| Each car has N0 tires. If there are N1 cars, how many tires are there in total?|Answer: N0 * N1
1635| Josh had N0 books in his library. He gave N1 books away. How many books does he have now?|Answer: N0 - N1
1636| There are N0 books on the shelf and N1 pencils on the desk. Sam placed N2 markers and N3 erasers on the desk. How many items are now there in total?|Answer: ( N0 + N1 ) + N2 + N3
1637| Mike picked N0 oranges , Nancy picked N1 oranges , and Keith picked N2 oranges and N3 strawberries , at the farm . How many oranges were picked in total ?|Answer: ( N0 + N1 ) + N2
1638| John went to the store to buy N0 apples. He then gave N1 away, and then bought N2 more the next day. How many apples does he have in total?|Answer: ( N0 + N2 ) - N1
1639| Ryan collected N0 apples . Zoe collected N1 apples . How many apples did they collect in total?|Answer: N0 + N1
1640| Gavin has N0 pencils. N1 are red and the rest are black. How many black pencils does Gavin have?|Answer: N0 - N1
1641| There were N0 players playing a board game when N1 players left. If each player had N2 pieces, how many pieces did they have total?|Answer: N2 * ( N0 - N1 )
1642| Seth bought N0 bottles of juice and N1 bottles of water. Each bottle of juice cost $ N2 and each bottle of water cost $ N3. How much more did Seth spend on juice than on water?|Answer: ( N0 * N2 ) - ( N1 * N3 )
1643| Jason went to the mall on Saturday to buy shoes. He spent $N0 on sneakers and $N1 on sandals. In total, how much money did Jason spend on shoes?|Answer: N0 + N1
1644| The town of Milburg has N0 cats and N1 dogs. How many animals live in Milburg?|Answer: N0 + N1
1645| Brad bought N0 bottles of apple juice and N1 cartons of orange juice. If each bottle contains N2 ounces of juice, how many ounces of juice did he have total?|Answer: N2 * (N0 + N1)
1646| I have N0 apples. If I put N1 apples in each basket, how many baskets will I fill?|Answer: N0 / N1
1647| Fred had N0 apples . Tim had N1 apples . How many apples did they have in total?|Answer: N0 + N1
1648| If each pair of socks costs $N0, how much must Kyoko pay for N1 pairs of socks?|Answer: N0 * N1
1649| Harry bought N0 candy bars and N1 lollipops for his birthday party. If he divided the candy into N2 even piles, how many candy items were in each pile? |Answer: (N0 + N1) / N2
1650| Each box contains N0 pieces of candy. How many pieces of candy are in N1 boxes?|Answer: N0 * N1
1651| A farmer had N0 geese and N1 chickens. During a sale he sold N2 birds. How many birds does he have left?|Answer: (N0 + N1) - N2
1652| A carpenter needed to build N0 shelves in a house. Each shelf takes N1 hours to build. If he already built N2 shelves, how much longer will he take to build the rest?|Answer: N1 * (N0 - N2)
1653| Emma sold N0 boxes of apples for each day she worked. If she worked for N1 days and sold N2 boxes of apples, but forgot to sell N3 boxes, how much money did she actually earn?|Answer: N0 * ( N1 - N3 )
1654| In a card game, each card drawn gives you N0 coins. If a deck has N1 cards total and you draw all but N2 of them, how many coins would you earn?|Answer: N0 * (N1 - N2)
1655| If Tom walked for N0 minutes at N1 feet per minute . How far did Tom go?|Answer: N0 * N1
1656| A store had N0 bottles of shampoo in stock. They ended up giving away N1 of them as samples. The put the ones they still had onto shelves with N2 on each shelf. How many shelves did they use?|Answer: (N0 - N1) / N2
1657| The school's soccer team had N0 players in total, N1 of which were male and N2 of which were female. If they were split into groups of N3 players, how many groups could they make?|Answer: (N0 + N1 + N2) / N3
1658| Mr. Smith has N0 dollars. A book costs N1 dollars. How many books can he buy with the money he has?|Answer: N0 / N1
1659| John had N0 books and N1 magazines in his library. If he gave away N2 of them, how many items were left in his library?|Answer: (N0 + N1) - N2
1660| Mike had N0 apples. Sam gave him N1 more apples. How many apples does Mike have altogether?|Answer: N0 + N1
1661| If there are N0 chairs in a room and John puts N1 more chairs inside, how many chairs are in the room?|Answer: N0 + N1
1662| Jack went to the park with N0 friends. When he got there, he met N1 more friends. He now has N2 friends in total. How many friends did he have before going to the park?|Answer: (N0 + N1) + N2
1663| Joe was helping the bakery workers box up cakes, but he could only carry N0 boxes at a time. If he had to box up N1 cakes from one tray and N2 cakes from another, how many trips will he make?|Answer: (N1 + N2) / N0
1664| A math team had N0 members total , but during a competition N1 members were absent . If each member that did show up scored N2 points , how many points were scored in total ?|Answer: N2 * ( N0 - N1 )
1665| Maria has N0 apples. Jacob has N1 more than Maria. How many apples does Jacob have?|Answer: N0 + N1
1666| Sandy had N0 quarters and N1 dimes in her bank. Her dad borrowed N2 dimes from Sandy. How many dimes does she have now?|Answer: N1 - N2
1667| Jim collected N0 apples. Mary collected N1 apples. How many apples did they collect in all?|Answer: N0 + N1
1668| Kai was playing a card game. In the first round he scored N0 points and in the second round he scored N1 points. In the last round he lost N2 points. How many points did he have at the end of the game?|Answer: (N0 + N1) - N2
1669| Mariah was helping a store owner move boxes of items from one room to another, but she could only carry N0 boxes at a time. If she had to move N1 boxes from one room and N2 boxes from another, how many trips will she make?|Answer: (N1 + N2) / N0
1670| Jake found N0 apples in the tree and weighed them with a scale. N1 apple was N2 ounces heavy. The other apple was N3 ounces heavy. How much heavier was the heavier apple?|Answer: N2 - N3
1671| Each student has N0 textbooks. If there are N1 students, how many textbooks are there in total?|Answer: N0 * N1
1672| On N0 consecutive shots , a basketball team scores N1 points , misses N2 shots , and scores N3 points . What number represents the total net points ?|Answer: ( N1 - N2 ) + N3
1673| Sarah had N0 books on her shelf. She added some more books and now she has N1 books. How many did she have to add?|Answer: N1 - N0
1674| There were a total of N0 books in the library. The library is open for N1 hours a day. How many books can be checked out each hour, if each hour has the same number of books?|Answer: N0 / N1
1675| Nick went to the hardware store to buy supplies for his next project. He purchased some nails for $N0, a hammer for $N1, and some paint for $N2. How much did Nick spend at the hardware store?|Answer: (N0 + N1) + N2
1676| Abigail had N0 cards in her collection. Her friend gave her some more cards. Now Abigail has N1 cards in all. How many cards did Abigail's friend give her?|Answer: N1 - N0
1677| Jason has N0 pieces of candy. Alyssa ate N1 of Jason's candy. How many pieces of candy does Jason have now?|Answer: N0 - N1
1678| There are N0 cats currently in the park . Park workers will bring in N1 more cats today . How many cats will the park have when the workers are finished ?|Answer: N0 + N1
1679| Chad has N0 blankets . Chad has N1 fewer blankets than Mark . How many blankets does Mark have ?|Answer: N0 + N1
1680| Jane has N0 new, blue pens and N1 new, green pens. How many pens does she have?|Answer: N0 + N1
1681| Steve has N0 apples. He gives N1 to Patrick and N2 to Jane. How many apples does Steve have left?|Answer: N0 - N1 - N2
1682| In August, James saved $N0. He saved $N1 in September and $N2 in October. Then James spent $N3 on a new bike. How much money does James have left?|Answer: ( ( N0 + N1 ) + N2 ) - N3
1683| Tom had N0 apples and Jane had N1 apples. How many apples did they have in total?|Answer: N0 + N1
1684| At the fair Adam bought N0 balloons. After playing the game he had N1 balloons left. If each balloon cost N2 dollars, how much money did Adam spend playing the game?|Answer: N2 * ( N0 - N1 )
1685| Emma has N0 books . Rachel has N1 books . She gives N2 to Lucas . How many books will Emma have ?|Answer: N0 - N2
1686| How many pencils would you have if you had N0 boxes of pencils with N1 pencils in each box?|Answer: N0 * N1
1687| Lana was sorting through her winter hats. She found N0 boxes of hats, and inside each box there were N1 hats and N2 earmuffs. How many pieces of winter headwear did Lana have total?|Answer: N0 * (N1 + N2)
1688| A store had N0 bottles of juice in a crate. If they drank N1 of the old ones and put N2 new ones into the crate, how many would be in the crate?|Answer: ( N0 + N2 ) - N1
1689| Isaac bought N0 apples. He gave N1 apples to his friends and put the rest in N2 different bags. How many apples were in each bag?|Answer: (N0 - N1) / N2
1690| There are N0 apples in the grocery store. If they are organized into N1 bags, how many apples are in each bag?|Answer: N0 / N1
1691| Joan had N0 apples this year. She had N1 apples last year. How many apples did Joan have in total?|Answer: N0 + N1
1692| A teacher started the day with N0 of coloring pencils. After giving out N1 of the pencils to her students, she now has N2 of them. How many pencils did the teacher give out?|Answer: N0 - N2
1693| Sara has N0 red and N1 blue balloons. Sandy has N2 yellow balloons. How many balloons of different colors do they have in total?|Answer: N0 + N1 + N2
1694| Christian and the junior ranger brought a bag of N0 apples as they visited every station assigned to the junior ranger. If they left exactly N1 apples in every station they visited, how many stations did Joline and the junior ranger visit?|Answer: N0 / N1
1695| Sam has N0 blue and N1 red balloons. Alyssa has N2 green balloons. How many balloons do they have in all?|Answer: N0 + N1 + N2
1696| There were N0 students in a classroom when N1 students left. If each student who left had N2 books in their backpack, how many books were left in the classroom?|Answer: N1 * ( N0 - N1 )
1697| I jog N0 laps around a track every N1 minutes. I jogged N2 laps. How many minutes did it take me?|Answer: N1 * N2
1698| Mr. Jones is making muffins. He needs N0 muffin tins to make N1 dozen muffins. How many muffin tins will he need to make one dozen muffins? |Answer: N0 / N1
1699| Mike has N0 dollars in N1 quarters . How many twenty-five cents coins does he have ?|Answer: N0 / N1
1700| Jordan builds a model 'N0 Ford F-150 . If the model car is N1 inches wide and the scale is N2 to N3 , how many inches would the real Ford F-150 be?|Answer: N1 * N3
1701| Abe's family took a vacation and stayed in a hotel for N0 nights. They had N1 people in their group, and each person paid N2 yen per night. How much did their hotel stay cost?|Answer: N0 x N1 x N2
1702| Julie had N0 pieces of clothing in her wardrobe. If she donated N1 pieces to charity and then bought N2 new pieces, how many pieces of clothing does she have in her wardrobe?|Answer: ( N0 + N2 ) - N1
1703| Mark was playing a board game . In the first round he scored N0 points and in the second round he scored N1 points . In the last round he gained N2 points . How many points did he have at the end of the game ?|Answer: ( N0 + N1 ) + N2
1704| Roger has N0 apples. He gives N1 to Jessica. How many apples will Roger have left? |Answer: N0 - N1
1705| At the farmer's market, Rachel sold N0 bunches of carrots and N1 bunches of onions. She had N2 bunches left over at the end of the day. How many bunches of produce did she sell?|Answer: ( N0 + N1 ) - N2
1706| At the store, they bought N1 apples for N0 dollars each. How much money did they spend on apples?|Answer: N0 * N1
1707| Gary had N0 books. He gave N1 books away as a gift. How many books did Gary have left?|Answer: N0 - N1
1708| George had N0 dollars. For his birthday he got N1 more dollars but spent N2 on a new bike. How much money does he have now?|Answer: (N0 + N1) - N2
1709| A grocery store had N0 boxes of apples when another N1 were brought in. If N2 boxes of apples are sold each day, how long will it take for all of them to be sold?|Answer: (N0 + N1) / N2
1710| Joyce has N0 books that must be put away in boxes. Fred comes to help and brings N1 apples to share with Joyce. If there are N2 boxes, how many books must go in each box?|Answer: N0 / N2
1711| Jane has N0 coins in her piggy bank. N1 are stolen by a thief. How many coins does Jane end with?|Answer: N0 - N1
1712| Nell has N0 friends. After inviting some more people to her party, she has N1 friends. How many people did Nell invite to her party?|Answer: N0 - N1
1713| Before starting her shift, a barista checks to make sure there is enough sugar packets for her customers. She finds N0 packets at the first table, N1 packets at the second table, and N2 packets at the third table. Altogether, how many sugar packets does the barista find?|Answer: (N0 + N1) + N2
1714| There were N0 chairs in a room . If N1 chairs were green and the rest were red , how many were red ?|Answer: N0 - N1
1715| Lucy has N0 cats . Lucy wants to buy N1 more cats . How many cats would Lucy have then ?|Answer: N0 + N1
1716| Emily was on an adventure and had N0 coins. During her journey she spent N1 coins to buy a map. If she found N2 coins while exploring, how many coins would she have?|Answer: ( N0 + N2 ) - N1
1717| There are N0 crayons in a box. Ernest has N1 crayons in a bag. Mark takes N2 crayons out of the box. How many crayons are left in the box?|Answer: N0 - N2
1718| You are baking a cake with N0 eggs. If you want to use the same number of eggs each day, how many would you have to use each day to finish in N1 days?|Answer: N0 / N1
1719| John has N0 apples. Mary gives John N1 more. How many apples does John have in all?|Answer: N0 + N1
1720| Mike invited N0 friends to a movie night, but N1 couldn't come. If he wanted to buy enough snacks so each person could have exactly N2, how many should he buy?|Answer: N2 * ( N0 - N1 )
1721| Tom and Dave decided to go hiking together. Tom brought N0 sandwiches and wanted to have N1 sandwiches each day during the hike. How many days can they go hiking with the sandwiches Tom brought?|Answer: N0 / N1
1722| Martha bought N0 books. She has N1 family members. She would like to divide the books among her family so that each member gets the same amount. How many books would each member get?|Answer: N0 / N1
1723| It took me N0 seconds to move N1 centimeters. How fast was I travelling?|Answer: N1 / N0
1724| There were N0 dogs and N1 cats in the park. How many animals were present in the park?|Answer: N0 + N1
1725| Our class got N0 apples from the store. Then we got N1 more apples from the store. How many apples did our class get from the store?|Answer: N0 + N1
1726| Adam decided to learn how to play the guitar. He purchased a guitar for $N0, a guitar stand for $N1, and some strings for $N2. How much did Adam spend at the store?|Answer: (N0 + N1) + N2
1727| John starts with N0 apples. He gives N1 apples to his sister. How many apples does John end with?|Answer: N0 - N1
1728| George drove to Mark's house. It is N0 miles from George's house to Mark's house. It took George N1 hours to get there. How fast did George go?|Answer: N0 / N1
1729| John was trying to fill his bookshelf. He bought N0 books from a local bookstore and N1 more from a flea market. If N2 of the books were damaged, how many good books did he end up with?|Answer: ( N0 + N1 ) - N2
1730| Mike picked N0 oranges and Jason picked N1 oranges from the orange tree. Fred picked N2 lemons from the lemon tree. How many oranges were picked in total?|Answer: N0 + N1
1731| Jack has N0 apples. Sarah took N1 of Jack's apples. How many apples does Jack have now? |Answer: N0 - N1
1732| There were N0 cars in the parking lot, but N1 of them were damaged. If each of the working cars was worth $N2, how much money could be made from selling them?|Answer: N2 * (N0 - N1)
1733| There are N0 small boats and N1 large ships currently in the harbor. Harbor workers had to remove N2 small boats that were damaged. How many small boats will the harbor have when the workers are finished?|Answer: N0 - N2
1734| John drove N0 miles to the store and N1 miles from the store to the park. How many miles did John drive in total?|Answer: N0 + N1
1735| Robert received N0 dollars for each hour he worked. If he worked N1 hours, but was paid for only N2 of them, how much money did he earn?|Answer: N0 * (N1 - N2)
1736| John went shopping for clothes. He bought a pair of jeans for $N0 and spent $N1 on a shirt. In total, how much did John spend on clothes?|Answer: N0 + N1
1737| A N0 pound bag of apples sells for N1 cents. What is the cost in cents per pound?|Answer: N1 / N0
1738| Janet picked N0 apples and N1 oranges to make fruit baskets. If she only used N2 of the fruits though, how many extra fruits did Janet pick?|Answer: (N0 + N1) - N2
1739| Brian earned N0 dollars per hour in his job. How much did he make in N1 hours?|Answer: N0 * N1
1740| Each child has N0 balloons. If there are N1 children, how many balloons are there in total?|Answer: N0 * N1
1741| John had N0 apples in his basket. If he gave away N1 of them, but then picked N2 more from the tree, how many would he have total?|Answer: ( N0 + N2 ) - N1
1742| A biologist measures a plant and finds that its circumference is N0 inches. At its last visit to the lab, the plant was N1 inches in circumference. How much did the plant grow, in inches?|Answer: N0 - N1
1743| Tim bought N0 apples and Sally bought N1 apples at the grocery store. When they got home, they discovered that N2 were bruised. How many apples did they buy together?|Answer: N0 + N1
1744| John had N0 stamps in his collection. He sold N1 of them but still had N2 albums of stamps to organize. If each album has the same number of stamps in it, how many stamps are in each album?|Answer: ( N0 - N1 ) / N2
1745| Maria had N0 books on her shelf , but needed N1 total for a complete library . If each one costs $ N2 , how much money would she need to finish her library ?|Answer: N0 * ( N1 - N0 )
1746| Dale's Vegetarian Restaurant harvested N0 squash and N1 pumpkins from their garden. How many fruits did Dale's Vegetarian Restaurant harvest in total?|Answer: N0 + N1
1747| Henry collected N0 coins from around the world. He put N1 coins into one jar and the rest into N2 different jars. How many coins were in each jar?|Answer: ( N0 - N1 ) / N2
1748| John ate N0 apples. Mary ate N1 apples. How many apples did they eat in total?|Answer: N0 + N1
1749| Mary earned N0 dollars delivering newspapers over the summer. If she spent N1 dollars on a new bicycle, how many N2 dollar movies could she watch with the money she had left?|Answer: ( N0 - N1 ) / N2
1750| Charles starts with N0 pieces of candy. Tom takes N1 away. How many pieces of candy does Charles end with?|Answer: N0 - N1
1751| Scott has N0 apples . He buys N1 more . Later , Scott buys N2 pears at the store . How many apples does Scott have in all ?|Answer: N0 + N1
1752| Elisa has N0 apples. How many more apples does she have to buy to have N1 apples?|Answer: N1 - N0
1753| Jacob ate N0 donuts. Sarah ate N1 donuts. How many donuts did they eat in all?|Answer: N0 + N1
1754| N0 cats are in a room . N1 more cats join them . How many cats in all ?|Answer: N0 + N1
1755| A pet shelter had N0 cats when another N1 were brought in. If N2 cats a day are adopted, how long would it take for all of them to be adopted?|Answer: ( N0 + N1 ) / N2
1756| Tom found N0 pieces of wood but N1 were rotten. How many usable pieces of wood did Tom find?|Answer: N0 - N1
1757| A soccer team had N0 players, but during the match N1 players were injured and had to sit out. If each player that was still able to play scored N2 goals, how many goals were scored in total?|Answer: N2 * ( N0 - N1 )
1758| Ann ate N0 apples , Robert ate N1 apples , and Sarah ate N2 apples . They were hungry for N3 hours . How many apples did they eat in total? |Answer: (N0 + N1) + N2
1759| Arthur adds N0 apples to a bowl. There were originally N1 apples in the bowl. How many apples are in the bowl now? |Answer: N1 + N0
1760| There are N0 books and N1 pens in the drawer . John added N2 books to the drawer . How many books are there now in all ?|Answer: N0 + N2
1761| Sara had N0 candy bars in her cupboard. Her mom gave her N1 candy bars. How many candy bars does she have now?|Answer: N0 + N1
1762| Mrs. Hilt went out to buy groceries and paid with a $N0 bill. After she got back, she checked her wallet and saw that she had $N1 left. How much did she spend? |Answer: N0 - N1
1763| John had N0 gallons of paint. If he used N1 gallons to paint the walls, how many N2 gallon buckets of paint would he have left?|Answer: ( N0 - N1 ) / N2
1764| Jack was planting some new flowers in his garden. He found N0 packs of flower seeds and each pack had N1 seeds in it. How many flower seeds did Jack have total?|Answer: N0 * N1
1765| Derrick drove N0 miles at N1 miles per hour. How long did Derrick drive?|Answer: N0 / N1
1766| While shopping for books online , Zoe bought N0 science books and N1 fiction books . Each book came with a bookmark and had N2 chapters . How many chapters did Zoe buy total ?|Answer: N0 * ( N0 + N1 )
1767| Paige had N0 English lessons and N1 history lessons for homework. If she finished N2 of the lessons at school, how many lessons did she have to do for homework?|Answer: ( N0 + N1 ) - N2
1768| At the school carnival, N0 students were selling balloons for N1 dollars each. If each student sold the same number of balloons, how many balloons did each student need to sell to make N2 dollars?|Answer: N2 / ( N0 * N1 )
1769| Bob's bakery was offering a special where each cake was N0 dollars. If Bob started with N1 cakes and had N2 cakes left, how much money did he make?|Answer: N0 * (N1 - N2)
1770| Our apples have N0 spots each. If we have N1 apples, how many spots should there be when all spots are counted from the apples?|Answer: N0 * N1
1771| For her birthday, Maria received N0 boxes of chocolates. She gave N1 boxes away, then divided the rest into piles with N2 chocolates in each. How many piles could she make?|Answer: (N0 - N1) / N2
1772| Kelly bought N0 boxes of apples and N1 bags of oranges. How many pieces of fruit did she buy in total?|Answer: N0 + N1
1773| Alex collected N0 apples, but the squirrels stole N1 apples. How many apples does Alex have?|Answer: N0 - N1
1774| Mrs. Wong had N0 bottles of wine. She gave N1 bottles to her friends. How many does she have left? |Answer: N0 - N1
1775| Kaleb had N0 pieces of candy. If he gave away N1 of them and used the money he earned to buy N2 more pieces of candy, how many pieces of candy would Kaleb have?|Answer: (N0 + N2) - N1
1776| While checking the stock in her store, Sarah notices that she had N0 cans of soda yesterday, but the supply is now down to N1 cans. How many more cans of soda did Sarah have yesterday?|Answer: N0 - N1
1777| A toy store had N0 cars in stock when they got another shipment with N1 cars in it. They put the cars onto shelves with N2 cars on each shelf. How many shelves did they use?|Answer: ( N0 + N1 ) / N2
1778| Megan had N0 cookies in her jar. If she gave away N1 of them and then added N2 more the next day, how many cookies would she have total?|Answer: ( N0 + N2 ) - N1
1779| A store had N0 boxes of apples to sell. If it sold N1, but then another N2 were delivered, how many boxes would it have to sell?|Answer: ( N0 + N2 ) - N1
1780| Jim has N0 apples, he gave Jane N1 of the apples. How many apples does he now have?|Answer: N0 - N1
1781| A carpenter needed to build N0 shelves in a library. Each shelf took N1 hours to build. If he already built N2 shelves, how much longer will he take to build the rest?|Answer: N1 * ( N0 - N2 )
