2218| Christian and the Junior Ranger bought N0 ice creams as they visited every station assigned to the Junior Ranger. If they left exactly N1 ice creams in every station they visited, how many stations did Christian and the Junior Ranger visit?|Answer: N0 / N1
2219| On a Sunday afternoon, a local farmer harvested N0 apples from his orchard. If N1 apples were harvested, how many baskets were filled with apples?|Answer: N1 / N0
2220| Tom has N0 pieces of candy to share among N1 of his friends. How many pieces of candy will each of his friends get?|Answer: N0 / N1
2221| Tom has N0 friends who love to collect coins. Tom has N1 coins in his collection, so if he wants to share the same amount of coins with each of his friends, how many coins will each of them receive?|Answer: N1 / N0
2222| Allen and Shiela have a collection of N0 marbles. Shiela splits the marbles into N1 piles, each of which contains the same number of marbles. How many piles did Shiela make?|Answer: N0/N1
2223| aside from baking cakes, John is fond of making pies. If he has N0 pies, how many pies can he give to each of his N1 friends?|Answer: N0 / N1
2224| it has been tradition in John's home to give a gift to each member of his family on their birthday. This year he bought N0 presents, each containing N1 different items. How many items does he have in total?|Answer: N0 x N1
2225| Jeff needs to buy N0 chairs for his family. Each chair costs N1 dollars. If he has N2 dollars, how many chairs can he buy?|Answer: N2 / N1
2226| In Simon's class N0 are students who love to play cards. If Simon has N1 cards, how many will each of the students receive?|Answer: N1 / N0
2227| When Haley and her family have N0 guests over for dinner, they need to set the table with N1 plates. If they want to make sure everyone gets the same amount of plates, how many plates will each person receive?|Answer: N0 / N1
2228| A large box of books was kept under John's bed. His mother placed the books in boxes for children in low-income households. If every box can contain N0 books and John has N1 books, how many boxes will be used?|Answer: N1 / N0
2229| John has N0 pencils in his drawer. He plans to donate them to his local school. If he puts them in boxes which can contain N1 pencils, how many boxes will he need?|Answer: N0 / N1
2230| On a cold winter morning, James bought N1 snowflake mugs from a store and wanted to give N2 of these mugs as gifts to his friends. How many snowflake mugs will each of his friends receive if he gives the same number of mugs to each of them?|Answer: N1 / N2
2231| Betty also bought N0 large green square stones. If N1 pieces of this stone is in each necklace, how many necklaces of green shiny square stones will there be?|Answer: N0 / N1
2232| Sam's brother wanted to give him N0 personalized mugs for his birthday. He also purchased N1 mugs from the store and gave them to Sam. How many mugs will each of the personalized mugs for Sam have?|Answer: N1 / N0
2233| Fred had N0 marbles and he wanted to have N1 of each color in each bag he makes. How many bags of marbles can Fred make?|Answer: N0 / N1
2234| John had N0 apples and wanted to share them with his friends. If each of his friends got the same number of apples, how many apples did each of them get? |Answer: N0 / N1
2235| On the first day of summer, Jack had collected N0 shells from the beach and wanted to give them out as presents. He had N1 friends, so he divided the shells equally among them. How many shells did each friend get?|Answer: N0 / N1
2236| Joe's dad collected N0 apples from his garden. If he wants to distribute them in boxes that can hold N1 apples each, how many boxes will he need?|Answer: N0 / N1
2237| Jane wanted to make cupcakes for her friends. If each cupcake needs N0 eggs, how many cupcakes can she make if they have N1 eggs?|Answer: N1 / N0
2238| For dinner, Bob's family prepared N0 pieces of pizza. If the N1 members of the family ate an equal number of pieces of pizza, how many pieces did Bob eat?|Answer: N0 / N1
2239| John is baking muffins for his friends. If he can place N0 muffins on a plate at a time, how many plates will he need to prepare N1 muffins at a time?|Answer: N1 / N0
2240| John wanted to bake a cake for his friend's birthday, so he made N0 cupcakes. If N1 serving is equal to N2 cupcakes, how many servings of cupcakes was John able to prepare?|Answer: N0 / N2
2241| Susie and her sister collected all N0 pieces of their puzzle and placed them on the shelves in their bedroom. If each shelf can hold a maximum of N1 pieces, how many shelves will be filled?|Answer: N0 / N1
2242| Mark's mother collected all his school certificates and wanted to place them into a folder. If a folder can contain N0 certificates, how many folders will she need if there are N1 certificates?|Answer: N1 / N0
2243| susie's father bought N0 new chairs to put in the living room. if he has N1 people who need to be seated, how many chairs will each person get?|Answer: N0 / N1
2244| matt and his friends were thinking of making a mosaic painting for the clubhouse in their neighborhood. They are to use N0 tiles in N1 different colors. If they used an equal number of tiles for every color, how many tiles are there for each color? |Answer: N0 / N1
2245| They gathered N0 pieces of fabric to make some flags. If each flag requires N1 pieces of fabric and they had N2 pieces of fabric, how many flags were they able to make?|Answer: N2 / N1
2246| Lex and Sheila had to paint a mural that was N0 feet long and N1 feet wide. They painted N2 feet a day. How many days did it take them to finish the mural?|Answer: N0 x N1 / N2
2247| Lex has N0 pieces of candy, and if he eats N1 pieces a day, how many days will it take him to eat all the candy?|Answer: N0 / N1
2248| If John had N0 gallons of paint and he needed to paint N1 rooms, how many gallons of paint did he use for each room?|Answer: N0 / N1
2249| Joe was into mathematics. He can solve N0 equations per hour of the book entitled ``Mathematics Made Easy``. If the book has N1 equations, how many hours did it take Joe to finish the book?|Answer: N1 / N0
2250| Paul had N0 books in his shelf at the start of the school year and he now has N1 books. How many books did Paul give away or sell over the year?|Answer: N0 - N1
2251| N0 people were standing in line. N1 more people joined the line. How many people were there in total in the line?|Answer: N0 + N1
2252| Cindy had N0 apples and Paul had N1 apples. They both decided to give their apples to their teacher. How many apples did they give to their teacher altogether?|Answer: N0 + N1
2253| beth has N0 balloons . she gives N1 of them away to jen . how many balloons does beth have left ?|Answer: N0 - N1
2254| Misha has N0 apples. How many apples does she have to earn to have N1 apples for a pie?|Answer: N1 - N0
2255| james had N0 pieces of candy. He gained some more candy for his birthday. Then he had N1 pieces of candy. How many pieces of candy did james get for his birthday?|Answer: N1 - N0
2256| there were N0 chickens in the farmer's coop. N1 of the chickens escaped. How many chickens were left in the coop?|Answer: N0 - N1
2257| There were N0 students in the science class and N1 students in the art class. How many students were in both classes combined?|Answer: N0 + N1
2258| Paul had N0 apples in his basket. He picked N1 more apples. How many apples did he have then? |Answer: N0 + N1
2259| Gary had N0 dollars. He spent N1 dollars on a new pair of shoes. How many dollars did Gary have left?|Answer: N0 - N1
2260| There are N0 cats. Each cat has N1 tails and N2 fur colors. How many tails are there in total?|Answer: N0 * N1
2261| If you had N0 books with N1 pages in each book, how many pages would you have?|Answer: N0 * N1
2262| If each pencil costs N0 cents, how much would N1 pencils cost?|Answer: N1 * N0
2263| For the sixth grade play the tables have been put into N0 groups with N1 tables in each group. How many tables have been put out for the play?|Answer: N0 * N1
2264| The ski lift at Winterland has N0 chairs. Each chair can hold N1 people. How many people can ride the ski lift at the same time?|Answer: N0 * N1
2265| a garden has N0 rows and N1 columns of trees. How many trees are there in all?|Answer: N0 * N1
2266| a garden is N0 meters long and N1 meters wide. How many square meters of ground does the garden cover?|Answer: N0 * N1
2267| sarah had N0 dollars and her brother had N1 dollars. How much more money did sarah have than her brother?|Answer: N0 - N1
2268| there are N0 classes in a school. Each class has N1 students. How many students are there in the school?|Answer: N0 * N1
2269| we bought N0 loaves of bread. Each loaf has N1 slices of bread. How many slices of bread are there altogether?|Answer: N0 * N1
2270| Mark had N0 bats and N1 balls , how many pieces of equipment did mark have ?|Answer: N0 + N1
2271| Emily collected beads from the jar and put them into N0 vases. She put N1 beads into each vase. How many beads did Emily collect?|Answer: N0 * N1
2272| there were N0 students in a class. Each student had N1 pencils. How many pencils were in the classroom?|Answer: N0 * N1
2273| There are N0 trees in a park. Each tree has N1 branches. How many branches are there in total?|Answer: N0 * N1
2274| there are N0 boxes. each box contains N1 pencils. How many pencils are there in all?|Answer: N0 * N1
2275| there are N0 bicycles . each bicycle has N1 wheels in it . how many wheels are there in all ?|Answer: N0 * N1
2276| your family is going on a picnic and you buy N0 sandwiches. Each sandwich has N1 pieces of cheese. How many pieces of cheese is that altogether?|Answer: N0 * N1
2277| Joe has N0 cars . each car has N1 seats in it . he also has N2 passengers . how many seats does Joe have altogether?|Answer: ( N0 * N1 ) + N2
2278| ted has N0 apples. He wants to put them into N1 baskets so there are the same number of apples in each basket. How many apples should go in each basket? |Answer: N0 / N1
2279| Martha bought N0 buckets of paint. She has N1 walls to paint. She would like to divide the paint among the walls so that each wall gets the same amount. How many buckets of paint would each wall get?|Answer: N0 / N1
2280| Maria is baking a cake. She has N0 cupcakes in all. If she wants to put exactly N1 cupcakes on each plate, how many plates would she need?|Answer: N0 / N1
2281| Adam's garden is N0 yards wide and N1 yards long. How much fencing does he need to enclose the whole garden?|Answer: N0 * N1
2282| it takes N0 hours to paint a wall. How many walls can be painted with N1 hours of work?|Answer: N1 / N0
2283| Sam swims N0 laps per day. How many laps will he swim in N1 days?|Answer: N0 * N1
2284| my car can travel N0 miles in N1 hours. How far can it travel in N2 hours?|Answer: N0 * N2
2285| it takes N0 hours to drive N1 miles. How long will it take to drive N2 miles?|Answer: N0 * N2
2286| I have N0 slices of pizza. If I eat N1 slices each day, how many days will it take for me to eat all the slices?|Answer: N0 / N1
2287| Jacob bought N0 bags of candy. Each bag contained N1 pieces of candy. How many pieces of candy did Jacob buy in total? |Answer: N0 * N1
2288| Jane was counting her pet mice and counted N0 in the first cage and N1 in the second cage. How many mice did she count in total?|Answer: N0 + N1
2289| we have N0 apples each containing N1 seeds. If we have N2 apples in total, how many seeds should there be when all the seeds are taken out of the apples?|Answer: N0 * N2
2290| N0 children are going to a school trip. There are N1 buses to take them to the trip. How many will go in each bus if the same number go in each bus?|Answer: N0 / N1
2291| I have N0 apples to buy oranges. If each orange costs N1 cents, how many oranges can I buy?|Answer: N0 / N1
2292| maggi had N0 boxes of cookies. There are N1 cookies in each box. She gave N2 cookies to her friends. How many are left?|Answer: ( N0 * N1 ) - N2
2293| N0 students are going to the park. They can fit N1 students in each car. How many cars will they need in total?|Answer: N0 / N1
2294| The bakery ordered N0 boxes of muffins. If each box contains N1 muffins, how many muffins did they order?|Answer: N0 * N1
2295| The ice cream shop makes $N0 dollars for each scoop of ice cream. On the hottest day of the summer, they sold N1 scoops of ice cream. How much money did they make from selling the ice cream?|Answer: N0 * N1
2296| The hardware store sells their tools for $N0. Last week they sold N1 tools. How much money did they make last week?|Answer: N0 * N1
2297| Warren has N0 boxes of chocolates to share with his party guests. Each guest will receive N1 chocolates. How many boxes will Warren need?|Answer: N0 / N1
2298| Ellen had N0 apples but she gave N1 of them to her brother. How many apples does she have now?|Answer: N0 - N1
2299| Arthur had N0 apples in his basket. After giving away N1 apples, how many apples does he have left?|Answer: N0 - N1
2300| George has N0 apples. Sarah has N1 apples. How many more apples does George have than Sarah?|Answer: N0 - N1
2301| there are N0 bottles of water in a fridge. If each bottle contains N1 litres of water, how many litres of water are there in the fridge?|Answer: N0 * N1
2302| There are N0 apples for N1 people to share. How much will each person get if they share the apples equally?|Answer: N0 / N1
2303| Preston has N0 books. He has N1 fewer books than Georgia. How many books does Georgia have?|Answer: N0 + N1
2304| If a family has N0 family members and each family member needs N1 pairs of shoes, how many shoes will the family need in total?|Answer: N0 * N1
2305| I have N0 marbles. If I put N1 marbles in each jar, how many jars will I fill?|Answer: N0 / N1
2306| Uncle Dave bought N0 packs of candy. If he wants to share them with his N1 friends, how many packs can each friend get?|Answer: N0 / N1
2307| Melissa had N0 apples. She received N1 more apples from her friend. How many apples does she have altogether?|Answer: N0 + N1
2308| a toy box holds N0 toys. there are N1 toys already in the box. How many more toys can be put in the box?|Answer: N0 - N1
2309| Kelly has N0 dollars. How much money will she have left if she spends N1 dollars?|Answer: N0 - N1
2310| John had some apples. He gave N0 to Sarah. Now he has N1 apples left. How many did he have to start with? |Answer: N1 + N0
2311| Iesha has N0 pencils. N1 are coloured and the rest are regular. How many regular pencils does Iesha have?|Answer: N0 - N1
2312| Joshua has N0 apples. Michael has N1 apples. How many more apples does Joshua have than Michael?|Answer: N0 - N1
2313| Sean has N0 balloons. He has N1 fewer balloons than Charles. How many balloons does Charles have?|Answer: N0 + N1
2314| Sam has N0 apples. Emma has N1 more apples than Sam. How many apples does Emma have?|Answer: N0 + N1
2315| Robin has N0 cats. Each cat has N1 kittens. How many cats and kittens does Robin have in total?|Answer: N0 + N0 * N1
2316| Jane has N0 apples and wants to buy N1 oranges that each cost $2. How much change will she get?|Answer: N0 - (N1 x 2)
2317| If each apple costs $N0, how much must Kyoko pay for N1 apples and N2 oranges?|Answer: N0 * N1 + N0 * N2
2318| Tony had $N0. He paid $N1 for a movie ticket. At the movie theatre he bought some popcorn for $N2. What amount of money did Tony have then?|Answer: (N0 - N1) - N2
2319| Mr. Guzman bought N0 cups of coffee packed equally into N1 boxes. How many cups of coffee were in each box?|Answer: N0 / N1
2320| N0 apples cost $ N1 each. N2 oranges cost $ N3 each. N4 lemons cost $ N5 each. If the cost of each fruit remains the same how much would N6 lemons cost?|Answer: N5 + N1
2321| In the town of Milburg, there are N0 buses and N1 cars. How many vehicles are there in total?|Answer: N0 + N1
2322| nathan bought N0 bags of candy for $ N1 . how much did each bag cost?|Answer: N1 / N0
2323| There were N0 people at a party. If N1 of them were adults and the rest were children, how many were children?|Answer: N0 - N1
2324| On Monday N0 students were absent from school. N1 more students were absent on Tuesday than on Monday. How many students were absent from school on Tuesday?|Answer: N0 + N1
2325| A school held a sports day with N0 teams, each team consisting of N1 students. How many students participated in the sports day?|Answer: N0 * N1
2326| There are N0 teachers teaching N1 classes each for the school term. How many classes will they teach altogether?|Answer: N0 * N1
2327| In N0 days a car driver drove N1 miles on Monday and N2 miles on Wednesday. If the driver drives the same number of miles N3 days in a row, how many miles does he drive in all?|Answer: (N1 + N2) * N3
2328| N0 cars were parked in each row of the parking lot. There are N1 rows in the parking lot. How many cars were parked in the parking lot?|Answer: N0 * N1
2329| Tyler had N0 cats. Each cat had N1 kittens. How many kittens does Tyler now have?|Answer: N0 * N1
2330| the farmer had N0 eggs. He gave N1 eggs to his chickens. How many eggs does he have now?|Answer: N0 - N1
2331| Jill invited N0 people to her house for dinner. Each person had N1 hotdogs. How many hotdogs did they eat in total?|Answer: N0 * N1
2332| Mr. Jones needs N0 gallons of paint to cover N1 square feet of wall. How many gallons of paint will he need to cover N2 square feet of wall?|Answer: N0 * N2
2333| Mr. Hilt bought N0 apples at the grocery store. The next week he went back to the store and bought N1 more apples. How many apples did he buy in total?|Answer: N0 + N1
2334| Mr. Smith went shopping for groceries last weekend. He bought N0 bags of apples and N1 cans of beans. If he wants to arrange all of his groceries in rows of N2 items each, how many rows will he have?|Answer: (N0 + N1) / N2
2335| mrs. hilt needs to buy N0 boxes of candy, and each box contains N1 pieces of candy. How many pieces of candy will each person get if the candy is shared equally among N1 people?|Answer: N0 * N1 / N1 = N0
2336| Mrs. Hilt went to the store N0 times. Each time she bought N1 items. How many items did Mrs. Hilt buy in total?|Answer: N0 * N1
2337| Mrs. Hilt is baking cookies. She needs N0 cups of sugar to bake N1 dozen of cookies. How much sugar will she need to make N2 dozen of cookies?|Answer: N0 / N1
2338| Mr. Smith was running a race. He ran N0 meters every N1 seconds. How many meters did he run in N2 seconds?|Answer: N0 * (N2 / N1)
2339| Mr. Hilt had N0 coins in his pocket. The next day he had N1 times that many coins. How many coins did he have on the second day?|Answer: N0 * N1
2340| Mr. Smith measured the width of the hallway. It was N0 feet. How many feet of the hallway will Mr. Smith walk if he walks up and down the hallway N1 times today?|Answer: N0 * N1
2341| Lucy has N0 coins in her pocket. She wants to buy N1 more coins. How many coins would Lucy have then?|Answer: N0 + N1
2342| Lucy has N0 balloons. How many more balloons does she need to buy to have N1 balloons?|Answer: N1 - N0
2343| Larry Lamb had a painful headache yesterday. When I looked into his ears yesterday I found N0 flying mosquitos buzzing around in his right ear and N1 crawling ants in his left ear. I removed the insects from Larry Lamb's ears. How many insects perished? |Answer: N0 + N1
2344| a pet supply store has N0 boxes of bird food and N1 boxes of fish food. How many more boxes of bird food are there than fish food?|Answer: N0 - N1
2345| N0 ducks are swimming in a pond. The pond has N1 lily pads. How many lily pads are not being used?|Answer: N1 - N0
2346| each box contains N0 items . how many items are in N1 boxes ?|Answer: N0 * N1
2347| Shelby had N0 pieces of fabric. She gave N1 pieces of fabric to each of N2 friends. How many pieces of fabric does Shelby have left?|Answer: N0 - ( N1 * N2 )
2348| Emma needs N0 packages of flour to make a cake. She already has N1 packages of all-purpose flour and N2 packages of pastry flour. How many more packages of flour should Emma buy?|Answer: N0 - ( N1 + N2 )
2349| A store had N0 pairs of shoes in stock when it opened. Later that day, N1 pairs were sold and N2 pairs were added. How many pairs of shoes were in the store at the beginning of the day?|Answer: (N2 + N0) - N1
2350| Max bought N0 apples from the store. He ate N1 and gave N2 away, how many apples did he have left?|Answer: ( N0 - N1 ) + N2
2351| John had some savings in the bank. He withdrew $N0 and added $N1 to it. If he had $N2 afterwards, how much money did he have in the bank initially?|Answer: (N2 - N1) + N0
2352| There are some books in a library. At a certain point, N0 books were added to the library and N1 books were taken away. If there are N2 books left in the library in the end, how many books were there at first?|Answer: ( N2 + N0 ) - N1
2353| Emily had N0 pieces of yarn. She used N1 of them to make a scarf and gave N2 of them away. If she had N3 pieces left, how many pieces of yarn did Emily have at first?|Answer: ( N3 + N2 ) + N1
2354| There are N0 chairs in a room. N1 of them are red, N2 of them are yellow, and the rest are blue. How many blue chairs are there in the room?|Answer: ( N0 - N1 ) - N2
2355| John has an N0 m long fence. He uses N1 m of it to build a gate and N2 m of it to build a trellis. How much of the fence is left in the end?|Answer: (N0 - N1) - N2
2356| There are N0 people in a classroom. N1 of them are teachers, N2 of them are students and the rest are parents. How many parents are there in the classroom?|Answer: (N0 - N1) - N2
2357| Robert made $N0 at work. He spent $N1 on a book and $N2 on a notebook. How much money did he have left?|Answer: (N0 - N1) - N2
2358| There are N0 pencils on a shelf. N1 of them are blue, N2 are yellow and the rest are red. How many red pencils are there on the shelf?|Answer: (N0 - N1) - N2
2359| There are a total of N0 bicycles at a store. N1 of them are mountain bikes and N2 of them are BMX bikes. How many road bikes are there?|Answer: (N0 - N1) - N2
2360| A grocery store has a total of N0 items. N1 of them are apples, N2 of them are oranges, and the rest are bananas. How many bananas are there?|Answer: (N0 - N1) - N2
2361| A school has N0 students. N1 are male and the rest are female. How many female students are there? |Answer: ( N0 - N1 )
2362| Roger has N0 marbles in a bag. He gives N1 of them to his brother and N2 of them to his sister. How many marbles does he have left?|Answer: ( N0 - N1 ) - N2
2363| At a movie theatre there are N0 people waiting to get in. N1 are children, N2 are adults, and the rest are teenagers. How many children are waiting in line at the movie theatre?|Answer: ( N0 - N1 ) - N2
2364| an international group had N0 british citizens and french citizens. N1 of them were british and N2 of them were french. How many citizens were from other countries?|Answer: (N0 - N1) - N2
2365| A summer sports camp had N0 campers, of which N1 were soccer campers, N2 were basketball campers, and N3 were football campers. If N4 campers left the camp, how many soccer campers were left?|Answer: (N0 - N4) - (N2 + N3)
2366| N0 flags are displayed in the town square. There are N1 red flags and N2 yellow flags. How many green flags are displayed?|Answer: (N0 - N1) - N2
2367| In a school there are N0 students . N1 students are absent today . N2 students are going on a field trip . How many students are left in the school?|Answer: ( N0 - N1 ) - N2
2368| There were N0 barrels of apples in a warehouse. The storekeeper sold N1 of them and N2 of the remaining apples were rotten and thrown away. How many fresh apples are left?|Answer: (N0 - N1) - N2
2369| Suzy has $ N0. She spent $ N1 on books and $ N2 on a new computer. How much does Suzy have left?|Answer: ( N0 - N1 ) - N2
2370| there are N0 animals in the zoo. N1 of them are lions, N2 of them are primates and the rest are reptiles. How many reptiles are in the zoo?|Answer: (N0 - N1) - N2
2371| there were N0 cars in a parking lot. N1 of them were stolen and another N2 of them were sold. How many cars were still left?|Answer: (N0 - N1) - N2
2372| a furniture store has N0 chairs in stock. N1 chairs are broken and N2 chairs are sold. How many chairs are left?|Answer: (N0 - N1) - N2
2373| Ryan had N0 pieces of candy. He gave N1 pieces to his friends and then dropped N2 pieces on the floor. How many pieces of candy are left in his collection?|Answer: (N0 - N1) - N2
2374| On her way to the store, Kendra noticed N0 trees in the morning and N1 more trees in the evening. How many trees did she see in total?|Answer: N1 + N0
2375| There are N0 cats and N1 dogs in a pet shelter. How many animals are there in the shelter?|Answer: N0 + N1
2376| There are N0 students in a classroom. If the school adds another N1 students, how many students will there be in the classroom?|Answer: N0 + N1
2377| Garrett went shopping for clothing and bought N0 sweaters and N1 shirts. How many items of clothing did he buy in all?|Answer: N0 + N1
2378| Jack received N0 oranges in the morning and N1 apples in the afternoon. How many fruits did Jack receive in the day?|Answer: N0 + N1
2379| a dance club has N0 members. If N1 new members join, how many total members are there in the dance club?|Answer: N0 + N1
2380| Every day Ryan spends N0 hours playing soccer and N1 hours playing basketball. How many hours does he spend playing soccer and basketball in all?|Answer: N0 + N1
2381| Alex had N0 pieces of candy. He gave N1 pieces to his friend and ate N2 pieces. How many pieces of candy did Alex have left?|Answer: ( N0 - N1 ) - N2
2382| Sam has N0 books. He divides them into N1 piles. If there are N2 books in the first pile, how many more books are there in the second pile than the first pile?|Answer: N0 - ( N2 * N1 )
