1476| Adam had N0 dollars . At the store he spent $ N1 on a new game . If he got another N2 dollars for his allowance , how much money did he spend in total ?|Answer: N0 + N1
1477| Faye and her mom were picking carrots from their garden . Faye picked N0 and her mother picked N1 . If only N2 of the carrots were good , how many carrots did they have in total ?|Answer: N0 + N1
1478| Sara picked N0 pears and N1 apples from the orchard . She gave N2 pears to Dan . How many more apples than pears did Sara get ?|Answer: N1 - N0
1479| Deborah is inviting N0 friends to a party . She has N1 cookies . How many cookies will be left over after each friend gets one ?|Answer: N1 % N0
1480| Sarah sold N0 boxes of Lemon Chalet Cremes. How many extra boxes does Sarah need to sell to fill one case of N1 boxes ?|Answer: N1 - N0
1481| A restaurant made N0 hamburgers to serve during lunch . Only N1 were actually served . How many hamburgers were left before lunch ?|Answer: N0 - N1 + N1
1482| There were N0 friends playing a video game online when N1 more players joined the game . If each player had N2 lives , how many more lives did they have than before ?|Answer: N2 * N1
1483| The first minute of a telephone call costs N0 cents and each additional minute N1 cents . How much money would be saved if the call were reduced by N2 minutes ?|Answer: N1 * N2
1484| For the school bake sale Katie made pastries . She baked N0 cupcakes and N1 cookies . After the sale she had N2 to take back home . How many cupcakes did she have left ?|Answer: N0 - N2
1485| April 's discount flowers was having a sale where each flower was N0 dollars . If Zoe bought N1 roses and N2 daisies , how much money did April make ?|Answer: N0 * ( N1 + N2 )
1486| Chloe was organizing her book case making sure each of the shelves had exactly N0 books on it . If she had N1 shelves of mystery books and N2 shelves of picture books , how many shelves did she have total ?|Answer: N1 + N2
1487| As part of a lesson on earthquakes , a science class is researching the movement of a nearby fault line . The fault line moved N0 inches during the past year and N1 inches the year before . How many more inches did the fault line move last year than the year before?|Answer: N0 - N1
1488| Amy was playing a video game where she scores N0 points for each treasure she finds . If she found N1 treasures on the first level and N2 on the second , how many more points did she score on the second level than on the first ?|Answer: N0 * ( N2 - N1 )
1489| If Charles strolled N0 miles at N1 miles per hour , how far did he travel in N2 hours ?|Answer: N0 * N2 / N1
1490| N0 people are going to the zoo , and there are N1 buses to take people . How many will go in each bus if the same number go in each one and no one is left out ?|Answer: ( N0 + N1 - 1 ) / N1
1491| Edward starts with N0 eggs . He receives N1 from Phillip . How many eggs does Edward end with ?|Answer: N0 + N1
1492| Joan has N0 blue balloons Melanie has N1 blue balloons . How many more blue balloons does Joan have than Melanie ?|Answer: N0 - N1
1493| A dust storm sweeps across the prairie . It covers N0 acres of the prairie in dust , but leaves N1 acres untouched . How many acres did the storm cover ?|Answer: N0 + N1
1494| Cindy ¡¯ s mom baked N0 cookies . Paul ¡¯ s dad baked N1 cookies . They both brought them to school for a party . How many more cookies did Cindy ¡¯ s mom bake than Paul ¡¯ s dad ?|Answer: N0 - N1
1495| For a birthday party Tom bought N0 regular sodas and N1 diet sodas . If his fridge would only hold N2 on each shelf , how many sodas would remain on the last shelf ?|Answer: N2 - ( ( N0 + N1 ) % N2 )
1496| Vanessa had N0 music files and N1 video files on her flash drive . If she deleted N2 of the files , how many fewer files were on her flash drive than when she started ?|Answer: N2 - ( N0 + N1 )
1497| N0 children were riding on the bus . At the bus stop , some more children got on the bus . Then there were N1 children altogether on the bus . How many children were on the bus originally ?|Answer: N1 - N0
1498| Henry had N0 dollars . For his birthday he got N1 more dollars but spent N2 on a new game . How much money did he get for his birthday ?|Answer: N1
1499| A teacher had N0 worksheets to grade . If she graded N1 , but then another N2 were turned in , how much more worksheets than she originally had to grade ?|Answer: N2 - N1
1500| Frank worked N0 hours on the first N1 days of the week . How many hours did he work on the last day of the week?|Answer: N0 - ( N0 * ( N1 - 1 ) )
1501| There are N0 oak trees currently in the park . Park workers will plant N1 oak trees today . How many more oak trees will the park have than it did before the workers started working ?|Answer: N1 - N0
1502| Christine wandered N0 miles at N1 miles per hour . How far did Christine travel in total ?|Answer: N0 * N1
1503| A store had N0 coloring books in stock . They ended up putting them on sale and getting rid of N1 of them . The put the ones they still had onto shelves with N2 on each shelf . How many coloring books were still left ?|Answer: ( N0 - N1 ) * N2
1504| Alyssa bought some toys . She bought a football for $ N0 , and spent $ N1 on marbles . In total , how much more did Alyssa spent on football than marbles?|Answer: N0 - N1
1505| Janet has N0 apples . She gives away N1 . How many apples does Janet have left ?|Answer: N0 - N1
1506| There are N0 students making N1 stars each for the school wall . How many fewer stars will they make if two students drop out?|Answer: ( N0 - 2 ) * N1
1507| At a pie - eating contest, Erik got through N0 pie before time was called ; Frank finished just N1 pie . How much pie was left when time was called ?|Answer: N0 + N1
1508| Sarah had N0 homework problems . She finished N1 of them but still had N2 pages of problems to do . If each page has the same number of problems on it , how many more problems does she have to do ?|Answer: ( N0 - N1 ) - N2
1509| Steven wants to split a collection of cards into groups of N0 . Steven has N1 cards . How many cards will be left over ?|Answer: N1 % N0
1510| If N0 lollipops cost N1 dollars , how many lollipops can you buy with N2 dollars ?|Answer: N2 / N1
1511| Dan had N0 baseball cards , and N1 were torn . Sam bought N2 of Dan 's baseball cards . How many baseball cards did Dan have before?|Answer: N0 - N1 + N2
1512| For homework Nancy had N0 math problems and N1 spelling problems . If she can finish N2 problems in an hour how many more math problems than spelling problems can she finish in an hour ?|Answer: N2 - N1
1513| Harry Hound had a terrible earache yesterday . When I peered into his ears yesterday , I found N0 frisky fleas having a party in his right ear and N1 baby fleas sleeping peacefully in his left ear . I cleaned out Harry Hound's ears . How many fleas were in his right ear?|Answer: N0
1514| Tommy had some balloons . His mom gave him N0 more balloons for his birthday . Then , Tommy had N1 balloons . How many balloons did Tommy receive for his birthday ?|Answer: N0
1515| Sally found N0 seashells , Tom found N1 seashells , and Jessica found N2 seashells on the beach . How many more seashells did Sally find than Jessica ?|Answer: N0 - N2
1516| Cindy ¡¯ s mom baked N0 cookies . Paul ¡¯ s dad baked N1 cookies . How many more cookies did Paul ¡¯ s dad bake than Cindy ¡¯ s mom ?|Answer: N1 - N0
1517| Roger earned N0 dollars for each lawn he mowed . If he had N1 lawns to mow , but forgot to mow N2 of them , how much money did he lose? |Answer: N0 * N2
1518| There are N0 students in the class and N1 tickets . If the tickets are divided equally among the students , how many tickets are left over ?|Answer: N1 % N0
1519| A waiter had N0 tables he was waiting on , with N1 women and N2 men at each table . How many more women than men did the waiter have ? |Answer: N0 * ( N1 - N2 )
1520| Mildred collects N0 oranges . Mildred 's father gives Mildred N1 more . How many oranges in total did Mildred and her father have ?|Answer: ( N0 + N1 ) * 2
1521| How many more cookies would you have if you had N0 bags of cookies with N1 cookies in each bag than if you had N2 bags of cookies with N3 cookies in each bag?|Answer: (N0 * N1) - (N2 * N3)
1522| There are N0 birds and N1 nests . How many birds can each nest hold ?|Answer: N0 / N1
1523| Sara has N0 black and N1 red marbles . Fred took N2 of Sara 's black marbles . How many marbles does Sara now have ?|Answer: N0 - N2 + N1
1524| For the school bake sale Paige made pastries . She baked N0 cupcakes and N1 cookies . After the sale she had N2 cupcakes to take back home . How many cookies did she sell ?|Answer: ( N1 + N2 ) - N0
1525| While playing a trivia game , Adam answered N0 questions correct in the first half and N1 questions correct in the second half . If each question was worth N2 points , what was the difference between his scores in the first and second half ?|Answer: N1 * N2
1526| At lunch a waiter had N0 customers and N1 of them did n't leave a tip . If he had $ N2 initially, how much money did he earn from the ones who did tip ?|Answer: N2 + ( N2 * ( N0 - N1 ) )
1527| Heather weighs N0 pounds . Emily weighs N1 pounds . Elizabeth weighs N2 pounds . How much lighter is Elizabeth than Heather ?|Answer: N2 - N0
1528| Melanie had N0 dimes in her bank . Her dad gave her N1 dimes and her mother gave her N2 dimes . How many more dimes did her parents give her than she already had ?|Answer: N1 + N2 - N0
1529| Roger was putting his spare change into piles . He had N0 piles of quarters and N1 piles of dimes . If each pile had N2 coins in it , how many more quarters than dimes did he have total ?|Answer: N2 * ( N0 - N1 )
1530| Brandon has N0 Skittles . Bonnie has N1 Skittles . He gains N2 . How many more Skittles does Brandon have than Bonnie ?|Answer: N0 - N1 + N2
1531| Roger had N0 dollars in January . By March he had spent N1 dollars . If he got another N2 dollars from his mom , how much money did he have in January ? |Answer: N0
1532| Ellen had N0 Legos , but she found N1 Legos . How many Legos does she have now ?|Answer: N0 + N1
1533| Dave was working as a sacker at a grocery store where he made N0 dollars an hour . On Monday he worked N1 hours and on Tuesday he worked N2 hours . How much money did Dave make in total ?|Answer: N0 * ( N1 + N2 )
1534| Emily was playing a trivia game . In the first round she scored N0 points and in the second round she scored N1 points . In the last round she lost N2 points . How many more points did she score in the first two rounds than she lost in the last round ? |Answer: ( N0 + N1 ) - N2 + N2
1535| Sara grew N0 pumpkins , but the rabbits ate N1 pumpkins . How many pumpkins did the rabbits eat ?|Answer: N1 - N0
1536| Mary loves eating fruits . Mary paid $ N0 for berries , $ N1 for apples , and $ N2 for peaches . In total , how much more money did she spend on berries than on peaches ?|Answer: N0 - N2
1537| Carrie 's mom gave her $ N0 to go shopping . She bought a sweater for $ N1 , a T - shirt for $ N2 , and a pair of shoes for $ N3 . How much did Carrie spend in total ?|Answer: N0 + ( N1 + N2 + N3 )
1538| Sam has N0 yellow and N1 green marbles . Joan took N2 of Sam 's yellow marbles . How many marbles does Sam now have ?|Answer: N0 + N1 - N2
1539| Gumballs come in packages of N0 . Nathan ate N1 gumballs . How many boxes did he eat in total and how many gumballs does he have left ? |Answer: N1 // N0 + N1 % N0
1540| Roger is at the library helping put away books . There are N0 book to put away total but a librarian takes N1 of them and leaves Roger with the rest . If he can fit N2 books on a shelf , how many books are left for him to put away ?|Answer: N0 - N1
1541| It took Amanda N0 hours to stroll to Kimberly 's house at N1 miles per hour . How much time will it take Amanda to have a round trip ?|Answer: 2 * N0
1542| Tom has N0 violet balloons , he gave Fred N1 of the balloons . How many more violet balloons than Fred has does he now have ?|Answer: N0 - N1 - N1
1543| The first act included N0 clown mobiles , each stuffed with N1 clowns . How many clown mobiles more than clowns are in the act ?|Answer: N0 - N1
1544| Chloe picked N0 carrots from her garden . If she threw out N1 of them and then picked N2 more the next day , how many more carrots did she pick the next day than she threw out the first day ?|Answer: N2 - N1
1545| N0 boats are in the lake . Each boat has N1 people . How many more people are there than boats in the lake ?|Answer: N0 * N1 + N0
1546| Megan had N0 markers . Robert gave her N1 more markers . How many more markers did Robert give her than she had initially ?|Answer: N1 - N0
1547| Sarah 's old washing machine could only wash N0 pieces of clothing at a time . If she had to wash N1 shirts and N2 sweaters how many pieces of clothing would she have to do ?|Answer: N1 + N2
1548| While making pastries , a bakery used N0 bag of wheat flour and N1 bag of white flour . How many more bags of wheat flour than white flour did the bakery use in all ?|Answer: N0 - N1
1549| While playing a trivia game , Frank answered N0 questions correct in the first half and N1 questions correct in the second half . If each question was worth N2 points , how many more questions than points did he get?|Answer: ( N0 + N1 ) - ( N0 * N2 )
1550| There are N0 pencils in the drawer . Tim placed N1 more pencils in the drawer . How many more pencils were there than initially ?|Answer: N1 + N1
1551| Eric wants to split a collection of peanuts into groups of N0 . Eric has N1 peanuts . How many peanuts will be left over ?|Answer: N1 % N0
1552| For Halloween Sarah received N0 pieces of candy . She ate N1 pieces then placed the rest into piles with N2 in each pile . How many pieces of candy are in each pile ?|Answer: N2
1553| Faye was playing a video game where she scores N0 points for each treasure she finds . If she found N1 treasures on the first level and N2 on the second , how many more points did she get from the second level than from the first ?|Answer: N0 * ( N2 - N1 )
1554| Kendall is learning to drive , so this weekend she practiced driving N0 mile with her mother and another N1 mile with her father . How much further did she drove with her mother than with her father ?|Answer: N0 - N1
1555| Marlee has N0 guests coming to her Halloween party . Each table will hold N1 guests . How many more guests will Marlee have than her tables can hold ?|Answer: N0 - ( N1 * N1 )
1556| Ned was helping the cafeteria workers pick up lunch trays , but he could only carry N0 trays at a time . If he had to pick up N1 trays from one table and N2 trays from another , how many trays will he be left with ?|Answer: N1 + N2 - N0
1557| There are N0 oak trees currently in the park . Park workers had to cut down N1 oak trees that were damaged . How many more oak trees were in the park before the workers started cutting down the damaged trees?|Answer: N0 + N1
1558| On the first day of the week Pat had N0 stickers . Pat earned N1 more during the week . How many more stickers did Pat have at the end of the week than on the first day ?|Answer: N1
1559| Melanie picked N0 plums , Dan picked N1 plums , and Sally picked N2 plums from the plum tree . How many more plums did Melanie and Dan pick together than Sally ?|Answer: ( N0 + N1 ) - N2
1560| A company painted some houses in Hancock County white and blue using a total of N0 gallons of paint . If they used N1 gallons of white paint , how many gallons of paint did the company use for both colors ?|Answer: N0 + N1
1561| Isabella ¡¯ s hair is N0 inches long . If she gets a haircut and now her hair is N1 inches long , how much shorter did her hair become ?|Answer: N0 - N1
1562| Sam had N0 pennies in his bank . He saved N1 of his pennies . How many pennies does he have now ?|Answer: N0 - ( N0 - N1 )
1563| In Yardley it snowed N0 inch in the morning and N1 inch in the afternoon . What was the difference between the morning and afternoon snowfall ?|Answer: N1 - N0
1564| David removes N0 eggs from a jar . There were originally N1 eggs in the jar . How many eggs did David remove?|Answer: N0 * N1
1565| At the fair there were N0 people in line for the bumper cars . If N1 of them got tired of waiting and left and N2 more got in line , how many people left the line ?|Answer: N1 - N2
1566| Adam bought N0 boxes of chocolate candy and gave N1 to his little brother . If each box has N2 pieces inside it , how many boxes did Adam still have ? |Answer: ( N0 - N1 )
1567| Iesha has N0 books . N1 are about school and the rest are about sports . How many books does Iesha have in total ?|Answer: N0 + N1
1568| The school cafeteria had N0 apples . If they used N1 to make lunch for the students and then bought N2 more , how many apples were used to make lunch ?|Answer: N1 - N2
1569| There school 's baseball team had N0 new players and N1 returning players . If the coach put them into groups with N2 players in each group , how many players will be left out of a group ?|Answer: ( N0 + N1 ) % N2
1570| Frank had saved up N0 dollars . If he received another N1 dollars for his allowance , what is the total amount of money Frank has now ?|Answer: N0 + N1
1571| Tom purchased a Batman game for $ N0 , and a Superman game for $ N1 . Tom already owns N2 games . How much does Tom have left in his wallet after purchasing the games ?|Answer: N2 - N0 - N1
1572| In Shannon 's apartment complex , N0 the apartments are one - bedroom apartments and N1 are two - bedroom apartments . What fraction of the apartments are one - bedroom apartments ?|Answer: N0/(N0 + N1)
1573| Kaleb started his own lawn mowing business . In the spring he made N0 dollars mowing lawns and in the summer he made N1 dollars . If he had to spend N2 dollars buying supplies , how much money did he make overall ?|Answer: N0 + N1 - N2
1574| In fourth grade there were N0 students at the start of the year . During the year N1 students left and N2 new students came to school . How many more students were in fourth grade at the end than at the start ?|Answer: N2 - N1
1575| There are N0 pencils in the drawer . Nancy placed N1 pencils in the drawer . How many more pencils are there now than before ?|Answer: N1
1576| There were N0 friends playing a video game online when N1 players quit . If each player left had N2 lives , how many lives were lost ?|Answer: N1 * N2
1577| Will had N0 dollars . If he spent N1 bucks on a new game , how much money does he have left ? |Answer: N0 - N1
1578| Dave had to wash N0 short sleeve shirts and N1 long sleeve shirts before school . If he had only washed N2 of them by the time school started , how many more short sleeve shirts than long sleeve shirts did he wash ?|Answer: N2 - N1
1579| Vince 's bus ride to school is N0 mile and Zachary 's bus ride is N1 mile . How much total distance do they travel in their bus rides?|Answer: N0 + N1
1580| Linda has N0 candies . Chloe has N1 . How many more candies does Linda have than Chloe has ?|Answer: N0 - N1
1581| Oliver had to wash N0 short sleeve shirts and N1 long sleeve shirts before school . If he had only washed N2 of them by the time school started , how many more short sleeve shirts than long sleeve shirts did he wash ?|Answer: N2 - N1
1582| There are N0 oranges in a box . Jonathan takes N1 oranges . How many oranges did Jonathan take ?|Answer: N1
1583| Lemon heads come in packages of N0 . Louis ate N1 Lemon Heads . How many remaining packages does he have and how many Lemon Heads does he have left ?|Answer: N1 % N0, N1 - ( N1 / N0 ) * N0
1584| Mary has N0 yellow marbles . Joan has N1 yellow marbles . How many more marbles does Mary have than Joan ?|Answer: N0 - N1
1585| Dan has N0 violet balloons . Tim has N1 times more violet balloons than Dan . How many more violet balloons does Tim have than Dan ?|Answer: N0 * ( N1 - 1 )
1586| For homework Faye had N0 math problems and N1 spelling problems . If she can finish N2 problems in an hour how many problems will she have left after one hour ? |Answer: N2 - ( N0 + N1 )
1587| For Halloween Emily received N0 pieces of candy from neighbors and N1 pieces from her older sister . If she only ate N2 pieces a day , how many pieces does she have left ?|Answer: ( N0 + N1 ) - N2
1588| Sally had N0 cards . Dan gave her N1 new cards . Sally bought N2 cards . How many cards did Sally have in the beginning ? |Answer: N0 + N1
1589| Ruby has N0 apples . Emily takes N1 away . How many apples did Emily take away ?|Answer: N1
1590| The Ferris wheel in Paradise Park has N0 seats . Each seat can hold N1 people . How many seats are needed to hold N2 people ?|Answer: N2 / N1
1591| John earned N0 dollars for each lawn he mowed . If he had N1 lawns to mow , but only mowed N2 of them , how much money did the other lawns pay him in total ?|Answer: N0 * N2
1592| Jack starts with N0 marbles . He shares N1 with Rebecca . How many marbles does Rebecca end with ?|Answer: N1
1593| Sarah had N0 homework problems . She finished N1 of them but still had N2 pages of problems to do . If each page has the same number of problems on it , how many more problems does she have to do ?|Answer: N0 - N1
1594| There are N0 books on the shelf . Marta put N1 more books on the shelf . How many more books did Marta put on the shelf than there were initially ?|Answer: N1
1595| Maria was making baggies of cookies with N0 cookies in each bag . If she had N1 chocolate chip cookies and N2 oatmeal cookies , how many more chocolate chip cookies than oatmeal cookies does she have ?|Answer: N1 - N2
1596| There are N0 bananas in a pile on the desk . Each banana comes in a package of N1 . N2 bananas are added to the pile . How many packages of bananas are there in the pile ?|Answer: ( N0 + N2 ) / N1
1597| Henry was helping the cafeteria workers pick up lunch trays , but he could only carry N0 trays at a time . If he had to pick up N1 trays from one table and N2 trays from another , how many trays will he have left after he has made all the trips ?|Answer: N0 - ( N1 + N2 )
1598| Roger had N0 pieces of clothing to wash . He put N1 of them in one load , but decided to split the rest into N2 equal loads . How many pieces of clothing did he put in the first load ?|Answer: N1 + ( N0 - N1 ) / N2
1599| Jason had N0 quarters in his bank . His dad gave him N1 more quarters . How many more quarters did he get from his dad ?|Answer: N1
1600| Albert has N0 bottle caps . Anne has with N1 bottle caps . Anne finds another N2 . How many bottle caps does Albert end with ?|Answer: N0 - N2
1601| A petri dish originally contained N0 bacteria . A scientist let the bacteria grow and now there are N1 of them . What is the total number of bacteria ?|Answer: N0 + N1
1602| The distance measured on a map varies directly with the actual distance . If N0 cm represents N1 kilometers , how many cm are represented by N2 kilometers ?|Answer: N2 / N1
1603| Nancy starts with N0 bottle caps . She gives away N1 bottle caps. How many bottle caps does Nancy end with ?|Answer: N0 - N1
1604| N0 beavers were working on their home . N1 went for a swim . How many beavers went for a swim ?|Answer: N1 - N0
1605| Dina made cookies . She used N0 cup of flour and N1 cup of sugar . How much total flour and sugar did Dina use ?|Answer: N0 + N1
1606| So far , an orchard has sold a combined total of N0 pounds of fresh and frozen fruit this season . If they have sold N1 percent of the fruit as frozen fruit , how many pounds of fresh fruit have been sold so far ?|Answer: N0 * ( 1 - N1/100 )
1607| Alyssa loves eating fruits . Alyssa paid $ N0 for grapes , and $ N1 for cherries . How much more money did Alyssa spend on grapes over cherries?|Answer: N0 - N1
1608| Hayley had N0 meatballs on her plate . Kirsten stole some of her meatballs . Now she has N1 meatballs on her plate . How many meatballs did Hayley start with ?|Answer: N0 + N1
1609| For the final act , the circus brought out dancing animals wearing crowns . If each crown is made with N0 different colored feathers , how many more feathers are needed for N1 crowns than for N2 crowns ?|Answer: (N0 * N1) - (N0 * N2)
1610| There are N0 popular trees currently in the park . Park workers will plant N1 more popular trees today . How many more popular trees are being planted today than already in the park ?|Answer: N1 - N0
1611| In fourth grade there were N0 students at the start of the year . During the year N1 students left and N2 new students came to school . How many students left the school during the year ? |Answer: N1
1612| Connie has N0 red markers and N1 blue markers . How many more red markers than blue markers does Connie have ?|Answer: N0 - N1
1613| There were originally N0 houses in Lincoln County . During a housing boom , developers built N1 more . How many more houses were built than there were originally in Lincoln County ?|Answer: N1 - N0
1614| In a video game , each enemy defeated gives you N0 points . If a level has N1 enemies total and you destroy all but N2 of them , how many points would you have left ?|Answer: N0 * N2
1615| Sandy had N0 pet fish . She bought N1 more fish . How many more fish does Sandy have now than she started with ?|Answer: N1 - N0
1616| There are N0 cards . N1 cards more are added . How many more cards are there than before ?|Answer: N1
1617| N0 ducks are swimming in a lake . N1 ducks fly away . How many ducks remain in the lake ?|Answer: N0 - N1
1618| Brad has N0 balloons . N1 balloons are red and the rest are green . How many more red balloons than green balloons does Brad have ?|Answer: N1 - N0
1619| At the arcade , Tom won N0 tickets playing ' whack a mole ' and N1 tickets playing ' skee ball ' . If he spent N2 tickets on a hat , how many more tickets did he win playing ' whack a mole ' than playing ' skee ball ' ?|Answer: N0 - N1 - N2
