2266| a sandbox is N0 centimeters long and N1 centimeters wide . how many centimeters of ground does the sandbox cover if the length and width are combined ?|Answer: N0 + N1
2267| sarah picked N0 apples . her brother picked N1 apples . how much more apples did sarah pick than her brother?|Answer: N0 - N1
2268| there are N0 fishbowls . each fishbowl has N1 fish . how many fishbowls more than fish are there ?|Answer: N0 - N1
2269| we ordered N0 pizzas . each pizza has N1 slices . how many more slices of pizza are there than pizzas ?|Answer: N0 * N1 - N0
2270| chris gave his N0 friends N1 pieces of candy each . how many pieces of candy did chris give in total?|Answer: N0 * N1 + N0
2271| emily collected eggs from the hen and put them into N0 baskets . she put N1 eggs into each basket . how many baskets did emily use ?|Answer: N0 / N1
2272| there were N0 book shelves . each book shelf had N1 books . how many empty shelves were there ?|Answer: N0 - N1
2273| there are N0 leaves . there are N1 ladybugs on each leaf . how many more leaves than ladybugs are there in all ?|Answer: N0 - N0 * N1
2274| there are N0 baskets . there are N1 apples in each basket . how many more baskets than apples are there ?|Answer: N0 - N1
2275| there are N0 pots . each pot has N1 flowers in it . how many more flowers are there than pots ?|Answer: N0 * N1 - N0
2276| your class is having a pizza party . you buy N0 pizzas . each pizza has N1 slices . how many more pizzas than slices is that altogether ?|Answer: N0 - N1
2277| beth has N0 packs of crayons . each pack has N1 crayons in it . she also has N2 extra crayons . how many more packs of crayons than crayons does she have ? |Answer: N0 - N2 / N1
2278| ted has N0 candy bars . he wants to put them into N1 bags so there are the same number of candy bars in each bag . how many bags will he need ?|Answer: N0 / N1 + 1
2279| martha bought N0 small cakes . she has N1 children . she would like to divide the cakes among her children so that each child gets the same amount . how many cakes are left over ?|Answer: N0 % N1
2280| julian is writing a comic book . his story has N0 frames in all . if he wants to put exactly N1 frames on each page how many frames would be left over?|Answer: N0 % N1
2281| jesse 's room is N0 feet long and N1 feet wide . how much more carpet does she need to cover the whole floor than if it was just N2 feet long ?|Answer: ( N0 - N2 ) * N1
2282| it takes N0 feet of cotton to make a tee-shirt . how many extra feet of material did she have to buy if she wanted to make N1 extra tee-shirts ?|Answer: N0 * N1
2283| lukas averages N0 points per game in basketball . if he scores 10 points more than average in N1 games, how many points would he score in total?|Answer: N0 * N1 + 10 * N1
2284| my car gets N0 miles per gallon . how many gallons of gas will i need to drive N1 miles ?|Answer: N1 / N0
2285| it takes N0 minutes to bake N1 pan of cookies . how long will it take to bake N2 pans of cookies if each pan has N3 more cookies in it?|Answer: N0 * N2 + N3
2286| my car gets N0 miles per gallon of gas . if grandma 's house is N1 miles away how much further can I drive with N2 gallons of gas ? |Answer: N0 * N2
2287| melissa scored N0 points in each game . how many more points did she score in N1 games than N2 games ?|Answer: ( N0 * N1 ) - ( N0 * N2 )
2288| johnny practiced for the track team and ran N0 laps per minute . how many laps did johnny run in N1 minutes ? |Answer: N0 * N1
2289| our watermelons have N0 seeds each . if we have N1 watermelons how many more seeds are there than the number of watermelons?|Answer: N0 * N1 - N1
2290| N0 people are going to the zoo . there are N1 cars to take people to the zoo . how many cars will be filled if the same number go in each car ?|Answer: N0 / N1 + 1
2291| i have N0 cents to buy candy . if each gumdrop costs N1 cents how much money will I have left over ?|Answer: N0 % N1
2292| maggi had N0 packages of cupcakes . there are N1 cupcakes in each package . she ate N2 cupcakes . how many packages does she have now ? |Answer: ( N2 / N1 ) - N0
2293| N0 children are taking a bus to the zoo . they sit N1 children in every seat . how many children will be left if every seat is filled ?|Answer: N0 % N1
2294| the razorback t-shirt shop ordered N0 cases of t-shirts . if each case contains N1 t-shirts how many cases did they order for N2 t-shirts? |Answer: N2 / N1
2295| the razorback t-shirt shop makes $ N0 dollars off each t-shirt sold . during the arkansas and texas tech game they sold N1 t-shirts . how much money did they make from selling N2 more t-shirts ? |Answer: N0 * ( N1 + N2 )
2296| the razorback t-shirt shop sells their t-shirts for $ N0 . last week they sold N1 t-shirts . how much money would they make if they sold N2 t-shirts ?|Answer: N0 * N2
2297| warren has N0 guests coming to his party . each table will hold N1 guests . how many extra chairs will he need ?|Answer: ( N0 - N1 ) ¡Á N1
2298| ellen had N0 legos but she lost N1 of them . how many legos had she originally ?|Answer: N0 + N1
2299| arthur baked N0 muffins . how many more muffins does arthur have to bake to have double the amount of muffins ?|Answer: N0 + N0
2300| willy has N0 crayons . lucy has N1 crayons . how many crayons do they have in total ?|Answer: N0 + N1
2301| there are N0 stickers on a page . if you have N1 pages of stickers how many stickers do you have left if you take away N2 stickers ?|Answer: N0 * N1 - N2
2302| there are N0 cupcakes for N1 children to share . how much of the cupcakes are left if each person gets an equal share ?|Answer: N1 * ( N0 / N1 )
2303| lizette has N0 stamps . she has N1 fewer stamps than minerva . how many stamps does lizette have ?|Answer: N0 + N1
2304| white t-shirts can be purchased in packages of N0 if mom buys N1 packages how many t-shirts will she have in all?|Answer: N0 * N1 + N1
2305| i have N0 pencils . if i put N1 pencils in each pencil box how many pencils will be left over ?|Answer: N0 - ( N1 * ( N0 / N1 ) )
2306| uncle dave bought N0 ice cream sandwiches . if he wants to give them to his N1 hungry nieces how many sandwiches will be left ?|Answer: N0 % N1
2307| megan had N0 markers . robert gave her N1 more markers . how many more markers does megan have than before? |Answer: N1
2308| a dvd book holds N0 dvds . there are N1 dvds already in the book . how many total dvds can fit in the book ?|Answer: N0 + N1
2309| kelly has N0 nintendo games . how many games does she need to add to her collection so that she will have N1 games in total? |Answer: N1 - N0
2310| connie had some marbles . she gave N0 to juan . now she has N1 marbles left . how many did she give juan ? |Answer: N0
2311| iesha has N0 books . N1 are about school and the rest are about sports . how many books about school does iesha have ?|Answer: N1
2312| james has N0 balloons . amy has N1 balloons . how many balloons do they both have in total ?|Answer: N0 + N1
2313| sean has N0 whistles . he has N1 more whistles that charles . how many whistles does sean have in all ?|Answer: N0 + N1
2314| connie has N0 marbles . juan has N1 less marbles than connie . how many marbles does connie have ?|Answer: N0 + N1
2315| robin has N0 packages of gum . there are N1 pieces in each package . how many packages of gum does robin have more than pieces of gum ? |Answer: N0 - N1
2316| adam has $ N0 to buy an airplane that costs $ N1 . how much money does he still need to buy the airplane ?|Answer: N1 - N0
2317| if each ball costs $ N0 how much must kyoko pay for N1 more balls than before ?|Answer: N0 * ( N1 + N1 )
2318| tony had $ N0 . he paid $ N1 for a ticket to a baseball game . at the game he bought a hot dog for $ N2 . what amount of money did tony have after he bought the hot dog ?|Answer: N0 - ( N1 + N2 )
2319| mr. guzman bought N0 doughnuts packed equally into N1 boxes . how many boxes did he buy in all ?|Answer: N0 / N1 + N1
2320| N0 stamp costs $ N1 . N2 stamps cost $ N3 . N4 stamps cost $ N5 . if the cost of each stamp remains the same how much would N6 stamps cost in total ?|Answer: N5 + N3 + N1
2321| the town of milburg has N0 grown-ups and N1 children . how many more grown-ups than children live in milburg ?|Answer: N0 - N1
2322| lisa rented N0 dvds for $ N1 . how much did she pay in total for the dvds ?|Answer: N0 * N1
2323| there were N0 pieces of candy in a jar . if N1 pieces were red and the rest were blue how many more blue pieces than red pieces were in the jar ?|Answer: N0 - N1 - N1
2324| on friday N0 people visited the zoo . N1 times as many people visited on saturday than on friday . how many more people visited the zoo on saturday than on friday ?|Answer: N0 * N1 - N0
2325| third-grade students went to a concert in N0 buses . each bus had N1 students . how many buses were needed to transport all students ?|Answer: N1 / N0
2326| there are N0 students making N1 stars each for the school wall . how many stars will be made in total if each student makes N2 more stars ?|Answer: N0 * ( N1 + N2 )
2327| in N0 week an airplane pilot flew N1 miles on tuesday and N2 miles on thursday . if the pilot flies the same number of miles N3 days in a row how many miles does he fly in a week ?|Answer: ( N1 + N2 ) * N3 / 7
2328| N0 students were sitting at each table in the lunchroom . there are N1 tables . how many empty chairs were in the lunchroom ?|Answer: ( N0 - 1 ) * N1
2329| tyler had N0 dogs . each dog had N1 puppies . how many more puppies than dogs does tyler now have ?|Answer: N0 * N1 - N0
2330| the farmer had N0 apples . he gave N1 apples to his neighbor . how many apples did he have originally? |Answer: N0 + N1
2331| jill invited N0 people to her birthday party . they each ate N1 pieces of pizza . how many more pieces of pizza did they eat than the number of invited guests?|Answer: N0 * ( N1 - 1 )
2332| mrs. hilt uses N0 ounces of detergent to wash a pound of clothes . how many ounces of detergent will she save if she washes N1 pounds of clothes instead ?|Answer: N0 * ( 1 - N1 )
2333| mrs. hilt went to a concert . a total of N0 people attended the concert . the next week she went to a second concert which had N1 more people in attendance . how many people attended both concerts in total?|Answer: N0 + (N0 + N1)
2334| mrs. hilt baked pies last weekend for a holiday dinner . she baked N0 pecan pies and N1 apples pies . if she wants to arrange all of the pies in rows of N2 pies each how many pies will be in the last row?|Answer: ( N0 + N1 ) % N2
2335| mrs. hilt needs to share $ N0 equally among N1 total people . how much money will remain after all people receive their share ?|Answer: N0 % N1
2336| mrs. hilt read N0 books . each book had N1 chapters in it . if each chapter has N2 pages , how many pages did mrs. hilt read ?|Answer: N0 * N1 * N2
2337| mrs. hilt is baking bread . she needs N0 cups of flour to bake N1 loaves of bread . how many loaves of bread can she make with N2 cups of flour ?|Answer: N2 / N0
2338| mrs. hilt saw a rollercoaster . N0 students rode the rollercoaster every N1 minutes . how many rides did the rollercoaster do in N2 minutes ?|Answer: N0 * ( N2 / N1 ) / N0
2339| mrs. hilt saw N0 bees in the hive . the next day she saw N1 times that many . how many more bees did she see on the second day than on the first day ?|Answer: N0 * ( N1 - 1 )
2340| mrs. hilt measured the distance from her desk to the water fountain . it was N0 feet . how many feet did mrs. hilt walk in all if she goes to the water fountain N1 times today ?|Answer: N0 * N1 + N1
2341| lucy has an aquarium with N0 fish . she wants to buy N1 more fish . how many more fish does she want compared to what she already has?|Answer: N1 - N0
2342| lucy has N0 fish . how many fish does she have left if she gives away N1 fish ?|Answer: N0 - N1
2343| harry hound had a terrible earache yesterday . when i peered into his ears yesterday i found N0 frisky fleas having a party in his right ear and N1 baby fleas sleeping peacefully in his left ear . i cleaned out harry hound 's ears . how many fleas were there in total ?|Answer: N0 + N1 + N0 + N1
2344| a pet supply store has N0 bags of dog food and N1 bags of cat food . how many total bags are there ? |Answer: N0 + N1
2345| N0 people are watching a movie in a theater . the theater has N1 seats . how many seats are filled in the theater ? |Answer: N0 - N1
2346| each bag contains N0 pounds of oranges . how many pounds of oranges are in N1 bags , if each bag weighed N2 pounds less ?|Answer: ( N0 - N2 ) * N1
2347| shelby had N0 pieces of candy . she gave N1 pieces each to N2 friends . how many pieces of candy did shelby give away in total ?|Answer: N1 * N2
2348| anita needs N0 cartons of berries to make a berry cobbler . she already has N1 cartons of strawberries and N2 cartons of blueberries . how many cartons of berries does anita have in total ?|Answer: N0 + N1 + N2
2349| there are some children at a bakery . as they were deciding what to buy N0 girls came in and N1 boys left . if there are N2 children in the bakery in the end how many boys left ?|Answer: N1
2350| blithe has a lot of toys . he lost N0 of them and found N1 in his closet . if he has N2 now how many toys has blithe lost ? |Answer: N0 - N2 + N1
2351| lena had some pocket money . she lost $ N0 and her mom gave her $ N1 . if she had $ N2 after that how much did lena's mom give her?|Answer: N2 - N0
2352| there are some passengers on a bus . at a bus stop N0 more passengers got on the bus and N1 passengers got off . if there are N2 passengers in the bus in the end how many passengers got on the bus at the bus stop ?|Answer: N0 - N1
2353| bruno had some story books . he lost N0 of them and his dad gave him N1 more books . if he had N2 books after that how many books did bruno and his dad buy in total ?|Answer: N2 + N1 + N0
2354| there N0 colored lights on a christmas tree . N1 of them are red N2 of them are yellow and the rest are blue . what is the difference between the number of red lights and blue lights ?|Answer: N1 - ( N0 - N2 )
2355| jennifer has an N0 cm long ribbon . she uses N1 cm of the ribbon to tie a present for her friend and N2 cm of the ribbon to make a bow . how much ribbon did she use in total ? |Answer: N1 + N2
2356| there are N0 passengers on a bus . N1 of them are men N2 of them are women and the rest are children . how many more men than women are there on the bus ?|Answer: N1 - N2
2357| robert made $ N0 at work . he spent $ N1 on a pen and $ N2 for a calculator . how much money did he have to spend ?|Answer: N0 + N1 + N2
2358| there are N0 books on a shelf . N1 of them are history books N2 of them are geography books and the rest are math books . how many more history books than math books are there on the shelf ?|Answer: N1 - ( N0 - N2 )
2359| there are a total of N0 items at a bakery . N1 of them are bread rolls and N2 of them are croissants . how many more items are there than just the bread rolls ?|Answer: N0 - N1
2360| a pet shop has a total of N0 animals . N1 of them are kittens and N2 of them hamsters the rest are birds . how many more animals are there than hamsters ?|Answer: ( N0 - N2 ) - N1
2361| a restaurant has N0 pieces of cutlery . N1 are forks N2 are knives and the rest are spoons . how many more forks than knives are there ?|Answer: N1 - N2
2362| debby makes N0 pancakes . she adds blueberries to N1 of them and bananas to N2 of them . the rest are plain . how many more blueberry pancakes than banana pancakes are there ?|Answer: N1 - N2
2363| at a carnival there are N0 kids teenagers and adults waiting to get in . N1 are teenagers N2 are adults and the rest are kids . how many more adults than kids are waiting in line at the carnival ?|Answer: N2 - ( N0 - N1 )
2364| an international group had N0 chinese americans and australians . N1 of them were americans and N2 of them were australians . how many americans were there ?|Answer: N1 - N2
2365| a summer sports camp had N0 soccer campers basketball campers and football campers . if N1 of them were basketball campers and N2 of them were football campers how many campers altogether were there ?|Answer: N0 + N1 + N2
2366| N0 medals are displayed in the sports center . there are N1 gold medals and N2 silver medals . how many medals are displayed in total ?|Answer: N0 + N1 + N2
2367| at a store there are N0 computers . N1 are sold . N2 are shipped away to a company . how many computers were shipped away ?|Answer: N2 + N1
2368| there were N0 pineapples in a store . the owner sold N1 pineapples . N2 of the remaining pineapples were rotten and thrown away . how many pineapples were sold and thrown away ?|Answer: N1 + N2
2369| lenny has $ N0 . he spent $ N1 on video games and $ N2 at the grocery store . how much did lenny spend in total ? |Answer: N1 + N2
2370| there are N0 trees in a park . N1 of them are huge ancient oaks and another N2 of them are medium-sized fir trees . the rest are saplings . how many trees are in the park ?|Answer: N0 + N1 + N2
2371| there were N0 trees in a park . N1 of them died and another N2 of them were cut . how many trees were cut down in total ?|Answer: N1 + N2
2372| a mirror store has N0 mirrors in stock . N1 mirrors are broken and N2 mirrors are sold . how many more mirrors were sold than broken ?|Answer: N2 - N1
2373| ryan collected N0 leaves . he lost N1 leaves . after a while N2 more leaves broke . how many total leaves did he collect ? |Answer: N0 + N1 + N2
2374| kendra took a road trip . in the afternoon she saw N0 minivans like hers . later in the evening she saw N1 more minivan like hers . how many more minivans like hers did she see in the evening than in the afternoon ?|Answer: N1 - N0
2375| there are N0 boys and N1 girls in a preschool daycare . how many more boys than girls are there in the daycare ?|Answer: N0 - N1
2376| there are N0 basketballs at a school . if the school buys another N1 basketballs how many more basketballs will the school have than initially ?|Answer: N1 + N1
2377| garrett went shopping for snack supplies and bought N0 oatmeal raisin granola bars and N1 peanut granola bars . how many more oatmeal raisin granola bars than peanut granola bars did he buy ? |Answer: N0 - N1
2378| jack received N0 emails in the morning and N1 emails in the afternoon . how many more emails did jack receive in the afternoon than in the morning ?|Answer: N1 - N0
2379| a chess club has N0 members . if N1 new members are enrolled how many more members are there in the chess club compared to before ?|Answer: N1
2380| every day ryan spends N0 hours on learning english and N1 hours on learning chinese . how many more hours does he spend on learning english than chinese ? |Answer: N0 - N1
2381| ryan collected N0 leaves . he lost N1 leaves and threw away N2 leaves . how many leaves did ryan have originally ?|Answer: N0 + N1 + N2
2382| sam has N0 power ranger stickers . he bundles them up in N1 boxes . if there are N2 power ranger stickers in the first box how many power ranger stickers are in the second box ?|Answer: N0 - N2
2383| beryl has N0 radishes . she puts them into N1 baskets . if there are N2 radishes in the first basket how many radishes are there in the second basket ? |Answer: N0 - N2
2384| there are N0 students in the class . the teacher wants to split them into N1 groups . the first group has N2 students . how many students are in each group ? |Answer: N0 / N1 - N2
2385| antonia has N0 barbie dolls . she packs away them in N1 wardrobes . if there are N2 barbie dolls in the first wardrobe how many barbie dolls are left to be packed in the second wardrobe?|Answer: N0 - N2
2386| savant has N0 jars . he puts in N1 coins in the first jar N2 coins in the second jar and N3 coins in the third jar . how many coins does savant save in total ?|Answer: N1 + N2 + N3
2387| an online toy store stocked some toys . it sold N0 toys at the first week and N1 toys at the second week . if it had N2 toys left how many toys were sold in total ? |Answer: N0 + N1
2388| mother bought some potatoes . she used N0 of the potatoes to make salads and N1 of the potatoes for mashed potatoes . if there were N2 potatoes left how many potatoes did mother use for salads ?|Answer: N2 - N1
2389| joshua has N0 toy boxes for his toy cars . he puts in N1 toy cars in the first toy box N2 toy cars in the second toy box and N3 toy cars in the third box . how many toy boxes does joshua need to fill all of his toy cars ?|Answer: ( N1 + N2 + N3 ) / N0
2390| there are some rooms in a building . N0 of them are classrooms N1 of them are office and the remaining N2 are reading rooms . how many more classrooms than offices are in the building ?|Answer: N0 - N1
2391| mr. peter harvested some pears . he picked N0 kg of the pears into a bag and N1 kg of the pears into another bag . if there were still N2 kg of pears left unpacked how many kilograms of pears were left unpacked? |Answer: N2
2392| gary had some stickers . he gave N0 stickers to lucy and N1 stickers to alex . if he had N2 stickers left how many stickers did he give away in total ?|Answer: N0 + N1
2393| a chef served N0 different foods for a banquet : N1 plates lobster rolls N2 plates of spicy hot noodles and N3 plates of seafood noodles . how many plates of seafood noodles did the chef make ?|Answer: N3
2394| a car dealer sold N0 cars on the first day N1 cars on the second day and N2 cars on the third day . how many cars did the car dealer sell in all ?|Answer: N0 + N1 + N2
2395| a washing machine can wash N0 pounds of clothes per day . if there are N1 pounds of clothes to be washed how many days will it take to wash all of the clothes ?|Answer: N1 / N0
2396| there are N0 pounds of sand to be filled into bags . if each bag has a capacity of N1 pounds how many pounds of sand would be left over?|Answer: N0 % N1
2397| if simon needs to make N0 gift bags at a rate of N1 bags per day how many bags of gift boxes will he have completed after N2 days ?|Answer: N1 * N2
2398| jane can arrange N0 vases of flowers in a day . if there are N1 vases of flowers to be arranged how many more days are needed for her to finish all the flower arrangements than if she had N2 vases of flowers to be arranged ?|Answer: ( N1 - N2 ) / N0
2399| a box can hold N0 pieces of chalk . if there are N1 pieces of chalk how many boxes are needed in total to hold all the chalk ?|Answer: ceil( N1 / N0 )
2400| a paper bag can hold N0 cookies . if edgar buys N1 cookies how many extra cookies does he have ?|Answer: N1 % N0
2401| a bus can transport N0 passengers . if a school of N1 students and teachers are going on a field trip how many passengers will be left over ? |Answer: N1 % N0
2402| if tom plans to fix N0 watches at the rate of N1 watches per day how many watches does he need to fix in total ?|Answer: N0 * N1
2403| the capacity of a tank is N0 gallons . if a company bought N1 gallons of oil how much capacity is left in the tank ?|Answer: N0 - N1
2404| mrs. smith gave N0 strawberries to N1 girls equally . how many strawberries were left after giving each girl ?|Answer: N0 - ( N0 / N1 )
2405| tom had $ N0 and he wanted to buy as many folders as he could . if N1 folder costs $ N2 how much money will be left over after he buys the folders ? |Answer: N0 - ( N1 * N2 )
2406| N0 students are going hiking . each school- bus can take N1 students . how many students will be left over ?|Answer: N0 % N1
2407| the teacher gave N0 pencils to N1 students equally . how many pencils did the teacher have in total ?|Answer: N0 * N1
2408| N0 boys went to water trees . there were N1 trees . if each of them watered 4 trees how many boys were there ?|Answer: N1 / 4
2409| there were N0 laptops in the shop and mike divided them equally into N1 rows . how many laptops are left after the division ?|Answer: N0 % N1
2410| there are N0 dogs in the farm . they live in N1 dog-houses equally . how many dog-houses are there in total ?|Answer: N0 / N1 + N1
2411| divide N0 balloons into N1 equal groups . how many groups are there in total ?|Answer: N0 / N1 + N1
2412| the school bought N0 basketballs and distribute them into N1 classes equally . how many total classes can be supplied with basketballs ? |Answer: N0 / N1 + N1
2413| there are N0 students in the class . the teacher divided them into N1 equal groups . how many groups did the teacher make in total?|Answer: N0 / N1 + N1
2414| a transport company bought N0 tons of oil . a large barrel can hold N1 tons of oil and a small barrel can hold N2 tons of oil . in order to use the least number of barrels and have the remaining oil stored in the least number of barrels how many small barrels should be used ?|Answer: N0 % N1 / N2
2415| N0 students split N1 portfolios of paintings . each student should get the same number of portfolios . how many portfolios of paintings are there in total ? |Answer: N0 * N1
2416| N0 students are forming teams for a mountaineering competition . each team should have N1 students . how many students will be in the last team ?|Answer: N0 % N1
2417| mr. lee wants to load N0 tons of his fruits . a large truck can load N1 tons of fruits and small truck can load N2 tons . in order to use the least number of trucks and have every truck fully occupied how many tons of fruits will be left ?|Answer: N0 % N1 + N2
2418| a tourist group has N0 people . at a hotel they want to rent some large rooms for N1 people each and some small rooms for N2 each . in order to rent the most number of rooms and have every room fully occupied how many small rooms should be rented ?|Answer: N0 / N2
2419| mr. lee harvested N0 apples and he packed them evenly in some baskets . if there are N1 apples in each basket how many apples are left over ?|Answer: N0 % N1
