0| Ryan has N0 trees in his garden and N1 potted plants on his balcony. How many plants does he have in total?|Answer: N0 + N1
1| For the sixth grade bake sale, the tables have been put into N0 rows with N1 tables in each row. How many tables have been put out for the bake sale?|Answer: N0 * N1
2| There are N0 cats and N1 dogs currently in the park. Park workers will adopt N2 cats today. How many cats will the park have when the workers are finished?|Answer: N0 + N2
3| Ann has N0 apples in her basket. Every day she eats N1 apples. She does not add any more apples to the basket. How many apples will Ann have in her basket after N2 days?|Answer: N0 - ( N1 * N2 )
4| There are N0 cats currently in the park. Park workers will add N1 cats today. How many cats will the park have when the workers are finished?|Answer: N0 + N1
5| Lola had N0 bottles of juice . There are N1 servings of juice in each bottle . She drank N2 servings . How many are left ?|Answer: N0 * N1
6| John has N0 pencils. His sister gave him N1 more. Mary has N2 erasers. How many pencils does John have?|Answer: N0 + N1
7| A baker needs to make N0 cupcakes. She has already made N1. If each cupcake takes N2 minutes to make, how long will it take her to make the rest?|Answer: N2 * ( N0 - N1 )
8| It takes N0 eggs to bake N1 cake. How many eggs does it take to bake N2 cakes?|Answer: N0 * N2
9| Peter bought N0 books, but needed N1 books total for his class. If he used N2 sheets of paper in each book, how many sheets of paper does he still need?|Answer: N1 * (N1 - N0)
10| Mary is making a pie. The recipe calls for N0 tablespoons of butter and N1 cups of sugar. She already put in N2 tablespoons of butter. How many tablespoons of butter does she need to add?|Answer: N0 - N2
11| Joe bought two packs of markers. One had N0 markers and the other had N1 markers. After one week he had already used N2 of them. How many markers does he still have?|Answer: ( N0 + N1 ) - N2
12| Mark has N0 coins . He borrows N1 coins from his friend . After that , Mark spends N2 coins on candy . How many coins does Mark have in all ?|Answer: N0 + N1
13| A DVD book holds N0 DVDs. There are N1 DVDs already in the book, and N2 DVDs are needed to fill it up. How many more DVDs must be added to the book?|Answer: N0 - (N1 + N2)
14| Sarah has N0 apples . She is given N1 more by her friend . How many apples does Sarah have in total? |Answer: N0 + N1
15| Emma made N0 dollars babysitting for her neighbors over the summer. If she spent N1 dollars on new clothes, how many N2 dollar books could she buy with the money she had left?|Answer: (N0 - N1) / N2
16| James has N0 apples. Amy has N1 oranges. How many more apples does James have than Amy?|Answer: N0 - N1
17| Mary has N0 packets of cookies. Each packet contains N1 cookies. She also has N2 extra cookies. How many cookies does Mary have altogether?|Answer: N0 * N1 + N2
18| Ben had N0 apples. If he gave away N1 of them, but then bought N2 more, how many would he have total?|Answer: (N0 + N2) - N1
19| A company invited N0 people to a party , but N1 had to cancel at the last minute . If each person was given N2 cupcakes , how many cupcakes did they need ?|Answer: ( N0 - N1 ) / N2
20| An aquarium in a park was filled with water. Before maintenance workers started to clean the aquarium, N0 liters of water were removed. While the workers worked, the aquarium leaked N1 liters of water. In all, how many liters of water were removed from the aquarium?|Answer: N0 + N1
21| A construction company ordered N0 gallons of paint, N1 rolls of wallpaper, and N2 yards of carpet. How many units of material did the company order in all?|Answer: (N0 + N1) + N2
22| Jessica had N0 apples and N1 oranges, but the birds ate N2 apples. How many apples does Jessica have?|Answer: N0 - N2
23| Jasmine had N0 books and Geraldine had N1 books. If they combined their books, how many would they have? |Answer: N0 + N1
24| Jerry was helping the library staff shelve books, but he could only carry N0 books at a time. If he had to shelve N1 books from one shelf and N2 books from another, how many trips will he make?|Answer: (N1 + N2) / N0
25| Mrs. Hilt measured the number of chairs in her classroom. It was N0 chairs. How many chairs will Mrs. Hilt count if she counts the number of chairs N1 times today?|Answer: N0 * N1
26| Last year, N0 trucks were sold in a store, and N1 trucks were donated to it. How many trucks were in the store at the end of the year?|Answer: N0 + N1
27| John rode his bike N0 miles at N1 miles per hour. How long did it take John to complete his ride?|Answer: N0 / N1
28| John had N0 books and wanted to give N1 books to each of his friends. He also wanted to keep N2 books for himself. How many friends did John have?|Answer: ( N0 - N2 ) / N1
29| John pays $N0 for each toy he buys. He purchased N1 toys on Monday, N2 toys on Tuesday and N3 toys on Wednesday. How much money did John spend in all?|Answer: N0 * ( ( N1 + N2 ) + N3 )
30| John had N0 apples in his basket. If he gave away N1 of them and then added N2 more, how many apples would he have total?|Answer: ( N0 + N2 ) - N1
31| My dog had some toys. Then, he gave away N0 toys. Now he has N1 toys. How many toys did he start with?|Answer: N1 - N0
32| There are N0 balloons in the party room. If N1 more balloons were added, how many balloons would there be in total?|Answer: N0 + N1
33| While taking a test, Jane answered N0 questions correctly in the first section and N1 questions correctly in the second section. If each question was worth N2 points, what was her final score?|Answer: N0 * ( N0 + N0 )
34| Haley and her friends were collecting cans for a charity drive. For every N0 cans they collected they earned one point. If Haley collected N1 cans and her friends collected N2 cans, how many points did they earn?|Answer: (N1 + N2) / N0
35| Mike had N0 apples in his roadside fruit dish. He went to the orchard and picked apples to stock up. There are now N1 apples. How many did he pick?|Answer: N1 - N0
36| Paige was unboxing some of her old winter clothes. She found N0 boxes of clothing and inside each box there were N1 sweaters and N2 hats. How many pieces of winter clothing did Paige have total?|Answer: N0 * (N1 + N2)
37| A school had N0 students in its student body. If N1 of them transferred out and the classrooms had N2 students in each class, how many classrooms were there?|Answer: ( N0 - N1 ) / N2
38| John has N0 pencils. He gave his friend N1 pencils. Now John has N2 pencils. How many pencils did John have to start with?|Answer: N2 - N1
39| Mike had N0 candy bars and he gave N1 of them away. If each candy bar cost N2 dollars, how much money did he spend?|Answer: N0 * N2 - N1 * N2
40| Gwen was organizing her CD collection making sure each of the albums had exactly N0 songs on it. If she had N1 albums of rock music and N2 albums of classical music, how many songs did she have total?|Answer: N0 * ( N1 + N2 )
41| John had saved up N0 dollars. If he received another N1 dollars from a summer job, how many N2 dollar books could he buy?|Answer: ( N0 + N1 ) / N2
42| Mary starts with N0 books. She finds another N1. How many books does Mary have in total?|Answer: N0 + N1
43| Andrew wanted to buy some ingredients for a cake. He bought N0 pounds of flour, N1 pounds of sugar and N2 pounds of butter. How many pounds of ingredients did Andrew buy altogether?|Answer: (N0 + N1) + N2
44| Jake has N0 apples and Sam has N1 apples. How many more apples does Jake have than Sam?|Answer: N0 - N1
45| For Christmas, Tyler received N0 pieces of cookies. He ate N1 pieces and then placed the rest into piles with N2 in each pile. How many piles could he make?|Answer: (N0 - N1) / N2
46| There are N0 dogs in the park. Mary brought N1 more dogs to the park. How many dogs are now there in all?|Answer: N0 + N1
47| While playing at the arcade , Mary won N0 tickets playing ' air hockey ' and N1 tickets playing ' pinball ' . If she was trying to buy a stuffed animal that cost N2 tickets a piece , how many could she buy ?|Answer: ( N0 + N1 ) / N2
48| A multi - national corporation has N0 part - time employees, N1 full - time employees, and N2 interns. How many employees work for the corporation?|Answer: N0 + N1 + N2
49| A package of pencils weighs N0 ounces. Each pencil weighs N1 ounces. How many pencils are there in the package?|Answer: N0 / N1
50| You have N0 apples and your friend has N1 apples. How many more apples do you have than your friend?|Answer: N0 - N1
51| At a museum, N0 people paid an admission fee of N2 each and N1 of them also bought a souvenir. If the souvenirs each cost N3, how much money did the museum make?|Answer: N2 * N0 + N3 * (N0 - N1)
52| There are N0 cats in an animal shelter. If N1 of them were adopted and the rest were put into N2 cages, how many cats would be in each cage?|Answer: ( N0 - N1 ) / N2
53| A tank at a factory was filled with N0 gallons of water. During a repair, N1 gallons of water leaked out before the tank was fixed. How many gallons of water leaked while the engineers were fixing the tank?|Answer: N1 - N0
54| If Amanda drove N0 miles at N1 miles per hour, how long was Amanda driving?|Answer: N0 / N1
55| A grocery store had N0 apples. In one day they sold N1 of them and put the rest into boxes with N2 in each box. How many boxes did they use?|Answer: ( N0 - N1 ) / N2
56| Dave went to the store and bought N0 t-shirts. He gave N1 of them to his friends, and kept N2 for himself. How many t-shirts did Dave still have?|Answer: N2 * ( N0 - N1 )
57| Mike found N0 apples and N1 oranges, but N2 of the apples were rotten. How many unrotten apples did Mike find?|Answer: N0 - N2
58| There are N0 scientists working in a laboratory. If N1 of them went on vacation and the rest were split into N2 teams, how many scientists would be in each team?|Answer: ( N0 - N1 ) / N2
59| Mrs. Hilt bought N0 boxes of pencils for $ N1 each . What was the total amount she paid for the boxes of pencils?|Answer: N0 * N1
60| A store had N0 blue shirts and N1 white shirts for sale. But, if only N2 customers wanted to buy shirts, how many extra did the store end up with?|Answer: ( N0 + N1 ) - N2
61| There were N0 cats and N1 dogs at a pet adoption center. If only N2 of them were adopted, how many animals were not taken home?|Answer: ( N0 + N1 ) - N2
62| Each apple costs $ N0 . How much do N1 apples cost ?|Answer: N0 * N1
63| Recently, the cost of John's new car increased by $N0. If his car was originally priced at $N1, how much does it cost now?|Answer: N1 + N0
64| A rectangle is N0 centimeters long and N1 centimeters wide . How many square centimeters of ground does the rectangle cover?|Answer: N0 * N1
65| A farmer has N0 horses in his stable. If each horse has N1 mules and N2 donkeys accompanying it, how many animals does the farmer have total?|Answer: N0 * ( N1 + N2 )
66| Mrs. Hilt bought N0 candy bars for N1 cents each. How much would N2 candy bars cost?|Answer: N0 * N1 * N2
67| Sally has N0 oranges. Fred has N1 times more oranges than Sally. How many oranges does Fred have now?|Answer: N0 * N1
68| If Steve ran N0 meters at N1 meters per second, how long was Steve running?|Answer: N0 / N1
69| Each student has N0 pencils. If there are N1 students in the classroom, how many pencils are there in total?|Answer: N0 * N1
70| Sam's garden is N0 feet long and N1 feet wide. How much soil does he need to cover the entire garden?|Answer: N0 * N1
71| There are N0 chairs for N1 people to sit on. How many chairs will each person get if they share the chairs equally?|Answer: N0 / N1
72| Jack has N0 red balloons. Sarah has N1 times more red balloons than Jack. How many red balloons does Sarah have now?|Answer: N0 * N1
73| The farmer asked Christian to help him plant N0 trees in the field. If every tree needs N1 buckets of water, how many buckets of water will they need?|Answer: N0 * N1
74| A pet store has N0 cats. If each cat has N1 kittens and N2 adults, how many cats does the pet store have total?|Answer: N0 * (N1 + N2)
75| For her birthday, Sarah received N0 books from her friends. She read N1 books the first day and then her brother gave her N2 more books. How many books does Sarah have now?|Answer: (N0 + N2) - N1
76| There were originally N0 laptops in the store. During a laptop sale, customers bought N1. How many laptops are there now in the store?|Answer: N0 + N1
77| The Hawks scored N0 baskets worth N1 points each . How many points do they have ?|Answer: N0 * N1
78| Sarah had N0 apples and Tim had N1 apples. How many apples did they have combined? |Answer: N0 + N1
79| Hot dogs are on sale at the grocery store for N0 dollars for a N1 pack . How much would each hot dog cost if purchased individually, in dollars?|Answer: N0 / N1
80| Paige had N0 English words to learn and N1 Spanish words to learn for her language class. If she remembered N2 of them in school, how many words did she have to learn for homework?|Answer: (N0 + N1) - N2
81| The school cafeteria ordered N0 cakes and N1 pies for students lunches. But, if only N2 students wanted desserts, how many extra did the cafeteria end up with?|Answer: (N0 + N1) - N2
82| Ryan made a carrot cake. He used N0 teaspoons of sugar and N1 teaspoons of salt. How much more sugar than salt did Ryan use?|Answer: N0 - N1
83| Bob has N0 apples. Sarah has N1 apples. If Sarah gives all of her apples to Bob, how many apples will Bob have? |Answer: N0 + N1
84| A plumber charges a customer N0 dollars for a plumbing job, and the customer pays N1 dollars for the service. Find the amount of profit based on the payment.|Answer: N1 - N0
85| Each adult has N0 plates . If there are N1 adults , how many plates are there in total ?|Answer: N0 * N1
86| While playing a game of Jeopardy, Jane answered N0 questions incorrectly in the first round and N1 questions correctly in the second round. If each question was worth N2 points, what was her final score?|Answer: N0 * (N0 + N1)
87| At Mr. Jones' house, there were N0 books on the shelf, and his neighbor had N1 books on their shelf. How many more books did Mr. Jones' house have?|Answer: N0 - N1
88| At a school festival N0 teachers and N1 students decided to start a game of tug of war. If they split into N2 teams how many people would be on each team?|Answer: ( N0 + N1 ) / N2
89| There were N0 cars in a parking lot when N1 more cars were added. If each car had N2 wheels, how many wheels were in the parking lot in total?|Answer: N0 * ( N0 + N1 )
90| Anna has N0 books and her friend gives her N1 more. How many books does Anna have in total?|Answer: N0 + N1
91| A student had N0 tests to take in a term. If the student has already taken N1 tests, how many more tests does the student have to take?|Answer: N0 - N1
92| Mrs. Hilt had N0 boxes of apples in her store. The next day she had N1 times that many. How many boxes of apples did she have on the second day?|Answer: N0 * N1
93| Jane has N0 blue balloons, Bob has N1 blue balloons, and Mary has N2 blue balloons. The balloons cost N3 dollars each. How many blue balloons do they have in all?|Answer: (N0 + N1) + N2
94| Evelyn starts with N0 apples. She gives N1 away to her friend, Tony. How many apples does Evelyn end with?|Answer: N0 - N1
95| A carpenter bought a roll of fabric that was N0 meters long. Then he cut N1 meters off the end. How long is the roll of fabric now?|Answer: N0 - N1
96| A store had N0 books in a shelf. If they threw away N1 of the old ones and put N2 new ones in the shelf how many would be in the shelf?|Answer: ( N0 + N2 ) - N1
97| Jack has N0 apples. Jane has N1 apples. How many apples do they have together?|Answer: N0 + N1
98| Mary had N0 balloons in her collection. Her brother gave her N1 balloons and her sister gave her N2 balloons. How many balloons does Mary have now? |Answer: ( N0 + N1 ) + N2
99| A train traveled N0 kilometers in N1 hours and N2 minutes. What was its average speed?|Answer: N0 / (N1 + (N2 / 60))
100| There are N0 cars parked in the lot. Today, N1 cars will be added to the lot and N2 cars will be removed. How many cars will be in the lot when the changes are finished?|Answer: (N0 + N1) - N2
101| There are N0 doors in each store . How many doors are in N1 stores?|Answer: N0 * N1
102| John was counting the number of bottles of water stored in his refrigerator. He found that he had N0 bottles of flavored water and N1 bottles of plain water, and each shelf had exactly N2 bottles. How many bottles did he have in total?|Answer: N0 * (N1 + N2)
103| John was counting the number of apples he had in his basket. If he had N0 baskets and each basket had N1 apples, how many apples did he have total?|Answer: N0 * N1
104| Karen added N0 cups of raisins to a batch of trail mix. Later, she added N1 cups of dried cranberries. How many cups of fruit did Karen put in the trail mix in all?|Answer: N0 + N1
105| There are N0 books and N1 pens in the drawer. Sam placed N2 books in the drawer. How many books are now there in total?|Answer: N0 + N2
106| John and Sarah go to the park. John brings N0 sandwiches, and Sarah brings N1 times as many sandwiches as John. How many sandwiches did Sarah bring? |Answer: N0 * N1
107| Cade had N0 apples. He gave N1 to his sister. He ate N2 himself. How many apples does he have left?|Answer: N0 - N1 - N2
108| Sam's art class was measuring fabric for a project. They found that the red fabric measured N0 feet, the green fabric measured N1 feet, and the blue fabric measured N2 feet. What was the total length of the fabrics?|Answer: (N0 + N1) + N2
109| A class of N0 students went on a field trip to a museum. The museum had N1 tickets for the group, and the teacher bought N2 more tickets for the group. If they all got the same amount, how many tickets did each person get?|Answer: (N1 + N2) / N0
110| John has N0 apples. How many more apples does he need to buy to have N1 apples?|Answer: N1 - N0
111| There are N0 coins in a jar. Each coin comes in a package of N1. N2 coins are added to the jar. How many coins are there in the jar?|Answer: N0 + N2
112| Terrell drove N0 miles on Monday. Then, on Tuesday, he drove another N1 miles. How far did Terrell drive all together? |Answer: N0 + N1
113| Sarah starts with N0 apples. N1 were given away to her friends. How many apples does Sarah end with?|Answer: N0 - N1
114| Max spent $N0 on a new jacket, $N1 on a bike, and $N2 on lunch. He wanted N3 books for $N4, but did not buy them. In total, how much did he spend?|Answer: (N0 + N1) + N2
115| For their birthday, John and his brother shared a cake. John had N0 slices while his brother had N1. If they ate N2 slices each, how many slices are left?|Answer: (N0 + N1) - N2
116| Each toy car costs $ N0 . How much do N1 toy cars cost ?|Answer: N0 * N1
117| Jay has some apples. He bought N0 apples. Now he has N1 apples all together. How many did he start with?|Answer: N1 - N0
118| David picked N0 oranges and N1 apples to make fruit baskets. If he only used N2 of the fruits though, how many extra fruits did David pick?|Answer: (N0 + N1) - N2
119| Jane ran N0 meters at N1 meters per second. How long did Jane run?|Answer: N0 / N1
120| The heaviest player on the basketball team weighs N0 pounds . This is N1 pounds heavier than the lightest player . How much does the lightest player weigh , in pounds ?|Answer: N0 - N1
121| How many cents would N0 groups of N1 bubble gum pieces cost if each group costs N2 dollars?|Answer: N0 * N1 * N2
122| John had N0 apples in his basket. He bought N1 more apples from the store. How many apples did he have then?|Answer: N0 + N1
123| Iesha has N0 coins. N1 are quarters and the rest are dimes. How many dimes does Iesha have? |Answer: N0 - N1
124| At a store each toy costs $ N0 and books are buy one get one free . If a group of N1 people came in and N2 wanted books , how much would it cost for the group to buy the items?|Answer: N0 * (N1 - N2) + N2 * N0 / 2
125| Sam had N0 dimes and N1 quarters in his bank. His dad gave him N2 quarters and N3 half-dollars. How many quarters does he have now?|Answer: N1 + N2
126| A baker needed to bake N0 loaves of bread . Each loaf takes N1 minutes to bake . If he already baked N2 loaves , how much longer will he take to bake the rest ?|Answer: N1 * ( N0 - N2 )
127| Sally ate N0 apples and Mary ate N1 apples from the apple tree. How many apples were eaten in total?|Answer: N0 + N1
128| A baker put leftover cakes into the fridge on Friday night. She noticed that the bakery had N0 cakes filled with chocolate, N1 cakes filled with banana, and N2 cakes filled with strawberry. How many leftover cakes did the bakery have in all?|Answer: (N0 + N1) + N2
129| Joe earned N0 dollars babysitting over the weekend. If he spent N1 dollars on a new t-shirt, how many N2 dollar movies could he watch with the money he had left?|Answer: ( N0 - N1 ) / N2
130| There are N0 books in a library. How many books are there in N1 libraries?|Answer: N0 * N1
131| Joe has N0 apples. Each apple weighs N1 kg and there are N2 apples in a basket. How much does Joe's apples weigh?|Answer: N0 * N1
132| Joan bought N0 apples at the store and ate N1 of them. How many apples does she have now?|Answer: N0 - N1
133| John had N0 balloons in his room. If he gave N1 of them away and then blew up N2 more, how many balloons would he have?|Answer: (N0 + N2) - N1
134| Each bag contains N0 apples. How many apples are in N1 bags?|Answer: N0 * N1
135| For Christmas, Katie and her sister received N0 and N1 gifts each. They decided to give away N2 gifts to their best friends. How many gifts do they have left?|Answer: (N0 + N1) - N2
136| A spaceship traveled N0 light - year from Earth to Planet X and N1 light - year from Planet X to Planet Y . Then it traveled N2 light - year from Planet Y to Planet Z . How many light - years did the spaceship travel in all ?|Answer: (N0 + N1) + N2
137| Martin has N0 friends and each friend has N1 siblings. How many people does Martin know?|Answer: N0 * N1
138| If John drove for N0 hours at N1 miles per hour, how far did John go?|Answer: N0 * N1
139| The Richmond Tigers sold a total of N0 jerseys last season. If they sold N1 jerseys in the first half of the season, how many jerseys did they sell in the second half?|Answer: N0 - N1
140| At the local amusement park, John rode the roller coaster N0 times and the carousel N1 times. If each ride cost N2 tickets, how many tickets did he use?|Answer: N2 * ( N0 + N1 )
141| Joe had N0 apples, he gave N1 of them to his friend. How many apples does he now have?|Answer: N0 - N1
142| Kelly has N0 books. How many does she need to buy so that she will have N1 books in total?|Answer: N1 - N0
143| Jack had N0 pieces of furniture but N1 of them were damaged. If he wanted to sell the undamaged pieces for $N2 each, how much money could he earn?|Answer: N2 * (N0 - N1)
144| Jesse has N0 pencils. If he divides them among N1 students, how many pencils does each student get?|Answer: N0 / N1
145| Rachel bought N0 new books and N1 new notebooks for her house. If she spent N2 minutes reading each book and N3 minutes writing in each notebook, how many minutes did it take her to finish?|Answer: N2 * N0 + N3 * N1
146| John wanted to join his school's choir. He bought a music stand for $N0 and a microphone for $N1. How much did John spend at the music store? |Answer: N0 + N1
147| Michael was hired to paint N0 rooms in N1 days. How many rooms will he have finished painting in N2 days?|Answer: N0 * N2
148| If David drove N0 kilometers in N1 hours, how fast was he driving?|Answer: N0 / N1
149| Matt has N0 books. How many more books does he need to find to have N1 books in his collection?|Answer: N1 - N0
150| Jim's class went on a field trip. His teacher drove the bus at N0 mph. They arrived at the destination after traveling for N1 hours. How far was the destination from their school?|Answer: N0 * N1
151| Peter has N0 apples but ate N1 of them. How many apples does Peter have now?|Answer: N0 - N1
152| John went to the grocery store last night. When he got there, he had to walk N0 mile from his house to the store. Then he walked N1 mile from the store to the park and N2 mile from the park back to his house. How many miles did John walk in all? |Answer: ( N0 + N1 ) + N2
153| Craig starts with N0 coins. N1 coins are given to a friend. How many coins does Craig end with?|Answer: N0 - N1
154| The school band had N0 instruments and N1 players. If they were split into groups of N2, how many groups could they make?|Answer: ( N0 + N1 ) / N2
155| Isabel had N0 books on her bookshelf. She gave N1 books away. How many books does she have left?|Answer: N0 - N1
156| A family had N0 cats and N1 dogs. They decided to give away N2 of their pets. How many pets do they have left? |Answer: (N0 + N1) - N2
157| Matthew has N0 blue marbles and Tyler has N1 blue marbles. How many blue marbles do they have in all?|Answer: N0 + N1
158| A beekeeper harvested N0 pounds of honey, but sold N1 pounds of it at the local market. How much honey remains?|Answer: N0 - N1
159| John starts with N0 coins. He gives N1 coins to his friend. How many coins does John end with?|Answer: N0 - N1
160| Jim collected N0 apples and Mike collected N1 apples from the apple tree. How many apples were collected in total?|Answer: N0 + N1
161| There are N0 books and N1 pens in the shelf . Sally took N2 books out of the shelf . How many books are there now ?|Answer: N0 - N2
162| Benny received N0 books and N1 candy bars for his birthday. He went to the toy store and bought a toy car, a stuffed animal, and a board game. He had N2 dollars over, how much did he spend on the toys?|Answer: N0 - N2
163| Joe has N0 apples. Sarah took N1 of Joe's apples. How many apples does Joe have now?|Answer: N0 - N1
