737| Bobby ate N0 pieces of candy. How many more pieces of candy than Bobby ate did he eat in all ?|Answer: N0 + N0
738| The school cafeteria had N0 apples . If they used N1 to make lunch for the students and then bought N2 more , how many apples did the cafeteria have after buying the new apples ?|Answer: N0 + N2
739| Marie starts with N0 erasers . She gains N1 . How many erasers does Marie end with ?|Answer: N0 + N1
740| While playing at the arcade , Frank won N0 tickets playing ' whack a mole ' and N1 tickets playing ' skee ball ' . If he was trying to buy candy that cost N2 tickets a piece , how many tickets does he have left ?|Answer: ( N0 + N1 ) - ( N2 * ( N0 + N1 ) )
741| N0 birds were sitting in a tree . Some more fly up to the tree . Then there were N1 birds in the tree . How many birds were there in the tree in total ?|Answer: N0 + N1
742| There were a total of N0 baseball games a month . The season is played for N1 months . How many more baseball games are in a season than in a month ?|Answer: N0 * ( N1 - 1 )
743| The next act involved several jugglers . If each juggler is juggling N0 balls at a time , how many more balls are needed if there are N1 jugglers putting a show at the same time than if there were only N2 jugglers ?|Answer: ( N0 * N1 ) - ( N0 * N2 )
744| Mrs. Hilt baked pies last weekend for a holiday dinner . She baked N0 pecan pies and N1 apples pies . If she wants to arrange all of the pies in rows of N2 pies each , how many pies will be left over ?|Answer: ( N0 + N1 ) % N2
745| Your class had a pizza party . N0 of a pizza was left over , and N1 of another pizza was left over . You put them both into one box . How much more pizza do you have than you started with ?|Answer: N0 + N1 - N0 - N1
746| Emily collected eggs from the hen and put them into N0 baskets . She put N1 eggs into each basket . How many baskets did Emily use in total ?|Answer: N0 + N1
747| Sandy grew N0 carrots and N1 turnips . Mary grew N2 carrots . How many more turnips than carrots did they grow in all ?|Answer: N1 - ( N0 + N2 )
748| Emily sprinted to Timothy 's house . It is N0 miles from Emily 's house to Timothy 's house . It took Emily N1 hours and N2 minutes to get there . How fast did Emily go ?|Answer: ( N0 / N1 ) + ( N2 / 60 )
749| Tiffany baked N0 brownies , but needed N1 total for her party . If she used N2 cups of flour on each one , how much more flour does she need in total compared to what she already used ?|Answer: ( N1 - N0 ) * N2
750| Lana 's favorite band was holding a concert where tickets were N0 dollars each . Lana bought N1 tickets for herself and her friends and N2 extra tickets in case anyone else wanted to go . How many tickets did she buy in total ? |Answer: N1 + N2
751| Rachel bought two coloring books . One had N0 pictures and the other had N1 . After one week she had already colored N2 of the pictures . How many pictures did she color in total?|Answer: N2 + N2
752| In March it rained N0 inches . It rained N1 inches less in April than in March . How much less did it rain in April than in March ?|Answer: N1
753| Oliver is at the library helping put away books . There are N0 book to put away total but a librarian takes N1 of them and leaves Oliver with the rest . If he can fit N2 books on a shelf , how many more books will he need ?|Answer: N1 - ( N0 - N2 )
754| Sean has N0 whistles .He has N1 less whistles than Charles . How many whistles does Charles have ?|Answer: N0 + N1
755| Larry has N0 cards . Dennis adds N1 cards . How many cards will Larry have ? |Answer: N0 + N1
756| There are N0 erasers in a box . Jane has N1 erasers in a bag . Doris takes N2 erasers out of the box . How many erasers are in the box and Jane's bag together?|Answer: N0 + N1 - N2
757| A candy store has N0 boxes of chocolates . Each box has N1 pieces and N2 lollipops . How many pieces and lollipops are there altogether in the store ?|Answer: N0 * (N1 + N2)
758| There are N0 students making N1 stars each for the school wall . How many more stars will they make if they work together than if they work alone ?|Answer: N0 * (N1 - 1)
759| Mrs. Hilt baked pies last weekend for a holiday dinner . She baked N0 pecan pies and N1 apples pies . If she wants to arrange all of the pies in columns of N2 pies each , how many columns will she have ?|Answer: ( N0 + N1 ) / N2
760| There are N0 walnut trees currently in the park . Park workers will plant N1 walnut trees today . How many more walnut trees will there be in the park when the workers are finished ?|Answer: N1 - N0
761| N0 people are going to the zoo . There are N1 cars to take people to the zoo . How many cars are left if they take N2 cars ?|Answer: N1 - N2
762| A toy store had N0 giant stuffed bears in stock when they got another shipment with N1 bears in it . The put the bears onto shelves with N2 on each shelf . How many bears were in total ?|Answer: N0 + N1
763| Rachel was playing a video game where she scores N0 points for each treasure she finds . If she found N1 treasures on the first level and N2 on the second , what is the difference between her scores on the two levels ?|Answer: N0 * ( N1 - N2 )
764| Denise removes N0 bananas from a jar . There were originally N1 bananas in the jar . How many bananas has Denise removed ?|Answer: N0 - N1
765| Mrs. Hilt wants to make a border around her garden . She needs N0 rocks to complete the border . She has N1 rocks . How many rocks does she have in total ?|Answer: N0 + N1
766| Wendy picked N0 flowers for her friend ¡¯ s wedding . She was making bouquets with N1 flowers in each one . If N2 of the flowers wilted before the wedding , how many flowers did Wendy have leftover ?|Answer: N0 - ( N1 * N2 )
767| A company invited N0 people to a luncheon , but N1 of them did n't show up . If the tables they had held N2 people each , how many people had to stand ?|Answer: ( N0 - N1 ) % N2
768| For a birthday party George bought N0 regular sodas and N1 diet sodas . If his fridge would only hold N2 on each shelf , how many sodas would be left on the shelf after the other is full ?|Answer: N2 - ( N0 + N1 ) % N2
769| Carol collects N0 peanuts . Carol 's father gives Carol N1 more . How many peanuts did Carol have before her father gave her any ?|Answer: N0 - N1
770| For Halloween Debby and her sister combined the candy they received . Debby had N0 pieces of candy while her sister had N1 . If they each ate N2 pieces the first night , how many more pieces did Debby eat than her sister ?|Answer: N0 - N2 - N1
771| Ruth starts with N0 apples . She shares N1 with Peter . How many apples does Peter end with ?|Answer: N1 - N0
772| Benny found N0 seashells and N1 starfish on the beach . He gave N2 of the seashells to Jason . How many more starfish than seashells does Benny now have ? |Answer: N1 - ( N0 - N2 )
773| Jorge scored N0 goals playing soccer last season . This season he scored N1 goals . What is the difference between goals scored last season and this season ?|Answer: N1 - N0
774| Anne weighs N0 pounds . Douglas weighs N1 pounds . How much lighter is Douglas than Anne ?|Answer: N1 - N0
775| At the arcade Cody won N0 tickets . If he spent N1 tickets on a beanie and later won N2 more tickets , how many tickets did he have before he spent any ?|Answer: N0 + N2
776| Benny worked N0 hours for N1 days . How many extra hours did he work compared to the previous day ?|Answer: N0 - N0
777| There were N0 friends playing a video game online when N1 players quit . If each player left had N2 lives , how many lives did they have altogether before they quit?|Answer: N2 * N0
778| Sarah had some trucks . She gave N0 to Jeff , and now she has N1 trucks left . How many trucks did Sarah give to Jeff ?|Answer: N0
779| Adam had N0 books . If he sold N1 of them and used the money he earned to buy N2 new books , how much money did Adam have left ?|Answer: N1 - N2
780| Ron weighed N0 colored metal balls during a science class . The blue ball weighed N1 pounds and the brown ball weighed N2 pounds . If Ron places both balls on the scale separately , what is the difference in the weight between the two balls ?|Answer: N1 - N2
781| Lexie ¡¯ s younger brother helped pick up all the paper clips in Lexie ¡¯ s room . He was able to collect N0 paper clips . If he wants to distribute the paper clips in N1 boxes , how many boxes will he need to fill the paper clips?|Answer: N0 / N1 + 1
782| Paco 's Countertop Company purchased pieces of marble from a quarry . The weights of the pieces they purchased were N0 ton , N1 ton , and N2 ton . How many more tons of marble did Paco 's Countertop Company purchase than the heaviest piece they bought ?|Answer: N1 + N2 - N0
783| Pamela bought N0 ounces of sugar , and she spilled N1 ounces of it on the floor . How many ounces of sugar does she have left?|Answer: N0 - N1
784| Dan has N0 violet marbles , he gave Mary N1 of the marbles . How many marbles does he have in total ?|Answer: N0 + N1
785| N0 boys went down the slide . N1 more boys went down the slide . How many more boys went down the slide the second time ?|Answer: N1
786| Brennan had N0 grams of pepper . Then he used N1 grams of the pepper to make some scrambled eggs . How many more grams of pepper did Brennan have than he used?|Answer: N0 - N1 - N1
787| Robin was making baggies of cookies with N0 cookies in each bag . If she had N1 chocolate chip cookies and N2 oatmeal cookies , how many extra cookies does she have left ?|Answer: ( N1 + N2 ) % N0
788| While playing a video game , Paul scored N0 points . He and his cousin together have a total of  N1 points . How many points does Paul have left to reach his goal of N2 points ?|Answer: N2 - N0 - N1
789| There are N0 books in Oak Grove 's public library . In addition , there are N1 books in its school libraries . How many more books does the public library have than the school libraries ?|Answer: N0 - N1
790| A waiter had N0 tables he was waiting on , with N1 women and N2 men at each table . How many more women than men did the waiter have ?|Answer: N0 * ( N1 - N2 )
791| Jane buys an apple for $ N0 and pays with a $ N1 bill . How much money did she pay ?|Answer: N0 + N1
792| N0 birds were sitting in a tree . N1 more birds flew up to the tree . How many more birds flew up to the tree than were originally there ?|Answer: N1 - N0
793| For the school bake sale Katie made N0 cupcakes . If she sold N1 of them and then made N2 more , how many cupcakes did she sell?|Answer: N1 - N2
794| Kaleb was selling his old games . He started out with N0 but sold N1 of them . He packed the rest up putting N2 games into each box . How many games were left in total?|Answer: ( N0 - N1 ) * N2
795| Sara grew N0 pumpkins , but the rabbits ate N1 pumpkins . How many pumpkins did the rabbits eat ?|Answer: N1
796| There are N0 walnut trees currently in the park . Park workers will plant N1 more walnut trees today . How many more walnut trees will the park have after the workers are finished ?|Answer: N1 - N0
797| Melanie had N0 dimes in her bank . Her dad gave her N1 dimes and her mother gave her N2 dimes . How many more dimes did her dad give her than her mother?|Answer: N1 - N2
798| I read N0 pages of my English book yesterday . Today , I read N1 pages . How many more pages did I read today than yesterday ?|Answer: N1 - N0
799| Barbara has N0 candies . She buys N1 more . If Barbara divide her candies equally how many candies will she give each person?|Answer: (N0 + N1) / 2
800| Jack has a section filled with short story booklets . If each booklet has N0 pages and there are N1 booklets in the short story section , how many more pages will Jack need to read if he wants to read all the booklets twice? |Answer: N0 * N1 * 2
801| Tom bought N0 tickets at the state fair . He spent N1 tickets at the ' dunk a clown ' booth and decided to use the rest on rides . If each ride cost N2 tickets , how much money did he save in tickets ?|Answer: ( N0 - N1 ) * N2
802| Brian has N0 cards . Wayne takes N1 away . How many cards did Wayne take ?|Answer: N1 - N0
803| Willie has N0 bananas . Charles has N1 bananas . He gains N2 . How many more bananas will Willie have than Charles ?|Answer: N0 - N1 + N2
804| Evelyn has N0 marbles . She gets N1 more from Henry . Later , Evelyn buys N2 cards at the store . How many more marbles does Evelyn have than cards?|Answer: N0 + N1 - N2
805| Sally had N0 baseball cards , and N1 were torn . Sara bought N2 of Sally 's baseball cards . How many baseball cards does Sally have left that are not torn ?|Answer: N0 - N1 - N2
806| Gwen bought two coloring books . One had N0 pictures and the other had N1 . After one week she had already colored N2 of the pictures . How many pictures did she color in total ?|Answer: N2 + N2
807| Diana starts with N0 bottle caps . N1 are eaten by a hippopotamus . How many bottle caps were eaten by the hippopotamus?|Answer: N1
808| There are N0 dogwood trees currently in the park . Park workers will plant N1 more dogwood trees today and N2 more dogwood trees tomorrow . How many more dogwood trees will the park have when the workers are finished than it currently has ?|Answer: N1 + N2
809| Luke was selling his old games . He started out with N0 but sold N1 of them . He packed the rest up putting N2 games into each box . How many games are left after being packed into boxes?|Answer: ( N0 - N1 ) % N2
810| Edward bought N0 tickets at the state fair . He spent N1 tickets at the ' dunk a clown ' booth and decided to use the rest on rides . If each ride cost N2 tickets , how much money did he spend at the booth ?|Answer: N1 * N2
811| The Montoya family spends N0 their budget on groceries and another N1 going out to eat . Altogether , what percentage of their budget does the Montoya family spend on food ? |Answer: 100 * (N0 + N1) / N0
812| A pet store had N0 siamese cats and N1 house cats . During a sale they sold N2 cats . How many cats did they sell ?|Answer: N2
813| A bucket contains N0 gallons of water . If Derek empties N1 gallons , how many gallons will be remaining ?|Answer: N0 - N1
814| Vanessa and her friends were recycling paper for their class . For every N0 pounds they recycled they earned one point . If Vanessa recycled N1 pounds and her friends recycled N2 pounds , how many points did they have before they started recycling ?|Answer: ( N1 + N2 ) - N0
815| While on vacation , Rachel took N0 pictures at the zoo and N1 at the museum . If she later deleted N2 of the pictures , how many more pictures did she take at the zoo than the museum?|Answer: N0 - N1 - N2
816| Lucy has an aquarium with N0 fish . She wants to buy N1 more fish . How many more fish would Lucy have than she originally had ?|Answer: N1 - N0
817| If Charles strolled for N0 hours at N1 miles per hour , how many miles did he travel ?|Answer: N0 * N1
818| A pet store had N0 siamese cats and N1 house cats . During a sale they sold N2 cats . How many cats did they sell in total?|Answer: N2 + N2
819| Sam went to N0 football games this year . He went to N1 games last year . How many more football games did Sam go to this year than last year ?|Answer: N0 - N1
820| A dust storm sweeps across the prairie . It covers N0 acres of the prairie in dust , but leaves N1 acres untouched . How many acres were covered by the dust storm ?|Answer: N0
821| A company invited N0 people to a luncheon , but N1 of them did n't show up . If the tables they had held N2 people each , how many people were seated at the tables ?|Answer: N2 * ( N0 - N1 )
822| Craig has N0 apples . Judy has N1 apples . He shares N2 with Eugene . How many apples did Craig and Judy have in total?|Answer: N0 + N1 - N2
823| Jill invited N0 people to her birthday party . They each ate N1 pieces of pizza . How many more pieces of pizza did they eat than people invited?|Answer: N0 * N1 - N0
824| Each year , salmon travel upstream , going from the ocean to the rivers where they were born . This year , N0 male and N1 female salmon returned to their rivers . How many more male than female salmon made the trip ?|Answer: N0 - N1
825| Bianca was organizing her book case making sure each of the shelves had exactly N0 books on it . If she had N1 shelves of mystery books and N2 shelves of picture books , how many more books did she have of mystery books than of picture books ?|Answer: N0 * N1 - N0 * N2
826| When Jake had N0 cat , he needed to serve N1 can of cat food each day . Now that Jake has adopted a second cat , he needs to serve a total of N2 can each day . How many cans of cat food does Jake need to serve each day in all ? |Answer: N2
827| There are N0 apples in a pile on the desk . Each apple comes in a package of N1 . N2 apples are added to the pile . How many packages are there in the pile ?|Answer: ( N0 + N2 ) / N1
828| There are N0 bicycles and N1 tricycles in the storage area at Danny 's apartment building . Each bicycle has N2 wheels and each tricycle has N3 wheels . How many more wheels are there in the tricycles than in the bicycles ?|Answer: ( N1 * N3 ) - ( N0 * N2 )
829| The school is planning a field trip . There are N0 students and N1 seats on each school bus . How many students need to take a second bus ?|Answer: N0 % N1
830| Rachel was playing a video game and had N0 lives . In a hard part of the game she lost N1 lives . If she got N2 more lives in the next level , how many lives had she had before the hard part ?|Answer: N0 + N1 - N2
831| Heather has N0 oranges . Russell takes N1 away . How many oranges does Russell have ?|Answer: N1
832| Vanessa had N0 music files and N1 video files on her flash drive . If she added N2 of the files , how many files are now on her flash drive ?|Answer: ( N0 + N1 ) + N2
833| Keith grew N0 turnips . Alyssa grew N1 turnips . How many more turnips did Keith grow than Alyssa ?|Answer: N0 - N1
834| There are N0 students in the class and N1 pencils . If the pencils are divided equally among the students , how many pencils are left over?|Answer: N1 % N0
835| Zoe baked N0 brownies , but needed N1 total for her party . If she used N2 cups of flour on each one , how much flour did she use in total ?|Answer: N2 * N0
836| Tom went to N0 hockey games this year , but missed N1 . He went to N2 games last year . How many more hockey games did Tom go to this year than last ?|Answer: N0 - N2
837| Emily bought N0 new chairs and N1 new tables for her house . If she spent N2 minutes on each piece furniture putting it together , how many minutes would it take her to finish if she worked at twice her current speed ?|Answer: N2 * ( N0 + N1 ) / 2
838| Sam has N0 books . Joan has N1 books . How many more books does Joan have than Sam ?|Answer: N1 - N0
839| Sam found N0 seashells and Mary found N1 seashells on the beach . How many more seashells did Sam find than Mary ?|Answer: N0 - N1
840| Sam had N0 dimes in his bank . His dad gave him N1 dimes . How much money does Sam have now ?|Answer: N0 + N1 x 0.1
841| A number is N0 more than the product of N1 and N2 . What is the number ?|Answer: N0 + N1 * N2
842| Sam went to N0 football games this year . He went to N1 games last year . How many more football games did Sam go to this year than last year ?|Answer: N0 - N1
843| Nancy bought N0 crayons that came in packs of N1 . How many crayons did Nancy buy in total ?|Answer: N0 * N1
844| Scarlett made a fruit salad with N0 pound of melon and N1 pound of berries . How many more pounds of melon than berries did Scarlett use ? |Answer: N0 - N1
845| At Oliver 's Restaurant a group with N0 adults and N1 children came in to eat . If each adult meal cost N2 dollars and each kids meal cost N3 dollars , how much was the bill ?|Answer: N2 * N0 + N3 * N1
846| A waiter had N0 customers to wait on . If N1 customers left and he got another N2 customers , how many customers would he have left?|Answer: N0 - N1 + N2
847| There are N0 marbles in each box . How many more marbles are in N1 boxes than N2 boxes ?|Answer: ( N0 * N1 ) - ( N0 * N2 )
848| A farmer estimates that he will harvest N0 bushels of wheat . The weather is perfect during the growing season , so he harvests N1 more bushels of wheat than expected . How many more bushels of wheat than expected did the farmer harvest ?|Answer: N1
849| Joan has N0 blue balloons , Sally has N1 blue balloons , and Jessica has N2 blue balloons . How many more balloons does Sally have than Jessica ?|Answer: N1 - N2
850| Jacqueline has N0 boxes of erasers . Each box holds N1 erasers and there are N2 boxes in a case . How many cases does Jacqueline have ?|Answer: N0 / N2
851| There are N0 fishbowls . Each fishbowl has N1 fish . How many fishbowls are there for every fish ?|Answer: N0 / N1
852| Vanessa and her mom were picking carrots from their garden . Vanessa picked N0 and her mother picked N1 . If only N2 of the carrots were good , how many carrots did they pick in total ?|Answer: N0 + N1
853| Brenda starts with N0 Skittles . She buys N1 more . How many more Skittles does Brenda end with than what she's started with ?|Answer: N1
854| There are N0 pots . Each pot has N1 flowers in it . How many more flowers are there than pots ? |Answer: N0 * N1 - N0
855| Juan ran N0 miles at N1 miles per hour . How much faster was Juan running than N2 miles per hour ?|Answer: N1 - N2
856| A painter needed to paint N0 rooms in a building . Each room takes N1 hours to paint . If he already painted N2 rooms , how many hours did he take in total ?|Answer: N1 * N2 + N1 * ( N0 - N2 )
857| April 's discount flowers was having a sale where each rose was N0 dollars . If April started with N1 roses and had N2 roses left , how much money did she need to make the sale ? |Answer: N0 * N2
858| Emily was planting vegetables in her garden . She started with N0 seeds and planted N1 of them in the big garden and in each of her small gardens put N2 seeds each . How many seeds did Emily have left ?|Answer: N0 - ( N1 + ( N2 * N2 ) )
859| Albert has two snakes . The garden snake is N0 inches long . The boa constrictor is N1 times longer than the garden snake . How many times longer is the boa constrictor than the garden snake ?|Answer: N1
860| Charles has N0 Skittles . Diana takes N1 away . How many Skittles does Diana have now ?|Answer: N1
861| Megan was selling her necklaces at a garage sale . She sold N0 bead necklaces and N1 gem stone necklaces . If each bead necklace cost N2 dollars and each gem stone necklace cost N3 dollars, how much money did she earn ?|Answer: N2 * N0 + N3 * N1
862| The school is planning a field trip . There are N0 students and N1 seats on each school bus . How many seats are left over after the trip ?|Answer: N0 % N1
863| Melanie goes fishing with Tom . Melanie catches N0 trout . Tom catches N1 times as many trout as Melanie . How many more trout did Tom catch than Melanie ?|Answer: N0 * ( N1 - 1 )
864| Mrs. Franklin had N0 Valentines . Mrs. Franklin gave some to her students . Now she has N1 . How many Valentines does she have left ?|Answer: N1 - N0
865| Isha ¡¯ s pencil is N0 inches long . If she sharpens it , now her pencil is N1 inches long . How much longer is her pencil than before ?|Answer: N1 - N0
866| Jerry had N0 action figures , but needed N1 total for a complete collection . If each one costs $ N2 , how much money did he spend on action figures so far ?|Answer: N2 * N0
867| Jill invited N0 people to her birthday party . They each ate N1 pieces of pizza . How many more pieces of pizza than people attended the party? |Answer: N0 * N1 - N0
868| There are N0 crayons and N1 pencils in the drawer . Sam placed N2 crayons in the drawer . How many more pencils than crayons are now there in total ?|Answer: N1 - N2
869| Jennifer starts with N0 apples . She buys another N1 . How many total apples does Jennifer have now ?|Answer: N0 + N1
870| Ned was trying to expand his game collection . He bought N0 games from a friend and bought N1 more at a garage sale . If N2 of the games did n't work , how many total games did he end up with ?|Answer: N0 + N1
871| Frank and his friend were buying trick decks from the magic shop for N0 dollars each . How much did they save if Frank bought N1 decks and his friend bought N2 decks ? |Answer: N0 * ( N1 + N2 ) - N0 * ( N1 * N2 )
872| In Mr. Olsen 's mathematics class , N0 the students received A 's and N1 received B 's . What fraction of the students received A 's ?|Answer: N0 / ( N0 + N1 )
873| Roger had N0 dollars . For his birthday he got N1 more dollars but spent N2 on a new game . How much money did he get for his birthday ?|Answer: N1 - N2
874| Sandy has N0 books , Benny has N1 books , and Tim has N2 books . How many more books does Sandy have than Benny and Tim combined ? |Answer: N0 - ( N1 + N2 )
875| There are N0 cards in Jean's card collection . If the cards are organized into N1 groups , how many cards remain after the groups are formed ?|Answer: N0 % N1
876| There were N0 pieces of candy in a jar . If N1 pieces were red and the rest were blue , how many more blue pieces than red pieces were there ?|Answer: N0 - N1 - N1
877| Martha has N0 peanuts . Joyce has N1 peanuts . If Joyce gives half of her peanuts to Martha , how many peanuts will Martha have ?|Answer: N0 + N1 / 2
878| Jason grew N0 watermelons and N1 cantelopes . Dan grew N2 watermelons . How many more watermelons than cantelopes did they grow in total ?|Answer: N0 + N2 - N1
879| There are N0 walnut trees currently in the park . Park workers will plant N1 walnut trees today . How many more walnut trees will the park have than it had originally ?|Answer: N1 - N0
880| A bathing suit manufacturer has a supply of N0 bathing suits for men . In addition , it has N1 bathing suits for women . How many more bathing suits are available for women than men ?|Answer: N1 - N0
881| A carpenter bought a piece of wood that was N0 meters long . Then she sawed N1 meters off the end . How much of the piece of wood was sawed off ? |Answer: N1
